-- phpMyAdmin SQL Dump
-- version 4.9.7
-- https://www.phpmyadmin.net/
--
-- Host: localhost:3306
-- Generation Time: Jan 21, 2022 at 11:24 AM
-- Server version: 10.5.13-MariaDB-cll-lve
-- PHP Version: 7.3.33

SET SQL_MODE = "NO_AUTO_VALUE_ON_ZERO";
SET AUTOCOMMIT = 0;
START TRANSACTION;
SET time_zone = "+00:00";


/*!40101 SET @OLD_CHARACTER_SET_CLIENT=@@CHARACTER_SET_CLIENT */;
/*!40101 SET @OLD_CHARACTER_SET_RESULTS=@@CHARACTER_SET_RESULTS */;
/*!40101 SET @OLD_COLLATION_CONNECTION=@@COLLATION_CONNECTION */;
/*!40101 SET NAMES utf8mb4 */;

--
-- Database: `konferwi_sistem`
--

-- --------------------------------------------------------

--
-- Table structure for table `absen`
--

CREATE TABLE `absen` (
  `id` int(11) NOT NULL,
  `id_pendaftaran` varchar(50) DEFAULT NULL,
  `waktu` varchar(50) DEFAULT NULL,
  `jenis_absen` varchar(50) DEFAULT NULL,
  `pengda` varchar(200) NOT NULL,
  `operator` varchar(50) NOT NULL
) ENGINE=InnoDB DEFAULT CHARSET=latin1;

--
-- Dumping data for table `absen`
--

INSERT INTO `absen` (`id`, `id_pendaftaran`, `waktu`, `jenis_absen`, `pengda`, `operator`) VALUES
(8, 'S0006', '2022-01-20 21:03:55', '1', 'SURABAYA', ''),
(9, 'S0006', '2022-01-20 21:10:19', '2', 'SURABAYA', ''),
(10, 'r0362', '2022-01-20 22:38:42', '1', 'LAMONGAN', ''),
(11, 'r0362', '2022-01-20 22:39:32', '2', 'LAMONGAN', ''),
(12, 'R0225', '2022-01-20 22:44:27', '1', 'PACITAN', ''),
(13, 'R0225', '2022-01-20 22:44:34', '2', 'PACITAN', ''),
(14, 'E0498', '2022-01-21 09:48:40', '1', 'KABUPATEN MALANG', ''),
(15, 'e0498', '2022-01-21 09:54:31', '2', 'KABUPATEN MALANG', ''),
(16, 'A0377', '2022-01-21 09:55:33', '1', 'GRESIK', ''),
(17, 'E0083', '2022-01-21 09:57:55', '1', 'PROBOLINGGO', '');

-- --------------------------------------------------------

--
-- Table structure for table `bukti_pembayaran`
--

CREATE TABLE `bukti_pembayaran` (
  `id` int(11) NOT NULL,
  `nama_lengkap` varchar(255) DEFAULT NULL,
  `pengda` varchar(255) DEFAULT NULL,
  `biaya` varchar(255) DEFAULT NULL,
  `tgl_bayar` varchar(255) DEFAULT NULL,
  `bukti_pembayaran` varchar(255) DEFAULT NULL,
  `id_pendaftaran` varchar(255) DEFAULT NULL,
  `status` varchar(5) NOT NULL
) ENGINE=InnoDB DEFAULT CHARSET=latin1;

--
-- Dumping data for table `bukti_pembayaran`
--

INSERT INTO `bukti_pembayaran` (`id`, `nama_lengkap`, `pengda`, `biaya`, `tgl_bayar`, `bukti_pembayaran`, `id_pendaftaran`, `status`) VALUES
(1, 'SWARTANA TEDJA, S.H.', 'SURABAYA', '499006', '24-12-2021', 'SWARTANA TEDJA, S.H.- Bukti_Pembayaran - BUKTI BAYAR.pdf', 'S0006', '1'),
(2, 'RANTI NURSUKMA HANDAYANI, SH.', 'SURABAYA', '499005', '30-12-2021', 'RANTI NURSUKMA HANDAYANI, SH.- Bukti_Pembayaran - Bukti Bayar Konferwil Jatim IPPAT 2021 an. Ranti Nursukma Handayani.jpeg', 'R0005', '1'),
(3, 'RB MOH FARID ZAHID, SH, MM,M.KN.', 'SUMENEP', '499007', '24-12-2021', 'RB MOH FARID ZAHID, SH, MM,M.KN.- Bukti_Pembayaran - WhatsApp Image 2021-12-24 at 08.16.30.jpeg', 'R0007', '1'),
(4, 'DR. CH. ANGGIA IKA HDKW, S.H., M.HUM.', 'MOJOKERTO', '499008', '30-12-2021', 'DR. CH. ANGGIA IKA HDKW, S.H., M.HUM.- Bukti_Pembayaran - WhatsApp Image 2021-12-30 at 14.31.10.jpeg', 'D0008', '1'),
(5, 'MAULI DINIARI, S.H., M.KN.', 'SIDOARJO', '499009', '30-12-2021', 'MAULI DINIARI, S.H., M.KN.- Bukti_Pembayaran - WhatsApp Image 2021-12-30 at 14.47.30.jpeg', 'M0009', '1'),
(6, 'LUKMAN HAKIM GUSTI, SH', 'SITUBONDO', '499011', '30-12-2021', 'LUKMAN HAKIM GUSTI, SH- Bukti_Pembayaran - IMG-20211230-WA0032.jpg', 'L0011', '1'),
(7, 'SANTI ARIANTI,S.H, M.Kn.', 'SURABAYA', '499001', '30-12-2021', 'SANTI ARIANTI,S.H, M.Kn.- Bukti_Pembayaran - BUKTI BAYAR KONFERWIL SANTI.jpeg', 'S0001', '1'),
(8, 'FERRY KURNIAWAN SUTANTO,S.H.,M.KN.', 'NGANJUK', '499012', '31-12-2021', 'FERRY KURNIAWAN SUTANTO,S.H.,M.KN.- Bukti_Pembayaran - CCA6CED2-D8F8-4106-AD05-7F8DD45376C1.jpeg', 'F0012', '1'),
(9, 'PRINGGO SOEBOWO,S.H.,M.Kn', 'LUMAJANG', '499014', '31-12-2021', 'PRINGGO SOEBOWO,S.H.,M.Kn- Bukti_Pembayaran - 20211231_093830.jpg', 'P0014', '1'),
(10, 'MILA ARRESTY SANDHY, SH., S.PSI., M.KN', 'KOTA MADIUN', '499016', '31-12-2021', 'MILA ARRESTY SANDHY, SH., S.PSI., M.KN- Bukti_Pembayaran - bukti bayar pendaftaran konfrensi jatim.jpeg', 'M0016', '1'),
(11, 'BAMBANG HERU DJUWITO, S.H, M.H.', 'SURABAYA', '499003', '31-12-2021', 'BAMBANG HERU DJUWITO, S.H, M.H.- Bukti_Pembayaran - bukti bayar konferwil054.pdf', 'B0003', '1'),
(12, 'HJ. SRI HARTATIK, S.H., M.Kn.', 'JOMBANG', '499013', '31-12-2021', 'HJ. SRI HARTATIK, S.H., M.Kn.- Bukti_Pembayaran - Hj Sri Hartatik Jombang.jpg', 'H0013', '1'),
(13, 'TITIEK NURHAYATI, S.H., M.Kn', 'GRESIK', '499010', '31-12-2021', 'TITIEK NURHAYATI, S.H., M.Kn- Bukti_Pembayaran - IMG-20211231-WA0005 - Copy.jpg', 'T0010', '1'),
(14, 'SUMARTINI, S.H., M.Kn.', 'SIDOARJO', '499018', '31-12-2021', 'SUMARTINI, S.H., M.Kn.- Bukti_Pembayaran - BUKTI TRANSFER SUMARTINI SH MKN.jpg', 'S0018', '1'),
(15, 'DEVIE OCTAVIA SARI,SH., M.Kn', 'SUMENEP', '499020', '31-12-2021', 'DEVIE OCTAVIA SARI,SH., M.Kn- Bukti_Pembayaran - IMG-20211231-WA0014.jpg', 'D0020', '1'),
(16, 'YUYUN ISNARIZANTI, SH.M.Kn.', 'GRESIK', '499017', '31-12-2021', 'YUYUN ISNARIZANTI, SH.M.Kn.- Bukti_Pembayaran - bukti bayar konferwil.jpg', 'Y0017', '1'),
(17, 'HAFID ABDUL AJIS, S.H., M.Kn.', 'SITUBONDO', '499021', '01-01-2022', 'HAFID ABDUL AJIS, S.H., M.Kn.- Bukti_Pembayaran - IMG-20220101-WA0018.jpg', 'H0021', '1'),
(18, 'VERRA EKA PUJI ISKANDAR, SH., M.Kn', 'SUMENEP', '499015', '01-01-2022', 'VERRA EKA PUJI ISKANDAR, SH., M.Kn- Bukti_Pembayaran - IMG-20220101-WA0032.jpg', 'V0015', '1'),
(19, 'ACHMAD ARIF KURNIAWAN, SH., M.Kn', 'KABUPATEN MALANG', '499022', '02-01-2022', 'ACHMAD ARIF KURNIAWAN, SH., M.Kn- Bukti_Pembayaran - IMG_20220102_203105.jpg', 'A0022', '1'),
(20, 'DEWI NASITAH, S.H., M.Kn.', 'KOTA MALANG', '499023', '02-01-2022', 'DEWI NASITAH, S.H., M.Kn.- Bukti_Pembayaran - Screenshot_2022-01-02-20-30-54-42_e8205ec1cda7e9657fadf502be9b7b78.jpg', 'D0023', '1'),
(21, 'YULI ENDAH WARDANTIK, S.H..', 'SURABAYA', '499027', '03-01-2022', 'YULI ENDAH WARDANTIK, S.H..- Bukti_Pembayaran - WhatsApp Image 2022-01-03 at 09.37.19.jpeg', 'Y0027', '1'),
(22, 'FARAH NURANI TJINONG, SH.', 'GRESIK', '499028', '03-01-2022', 'FARAH NURANI TJINONG, SH.- Bukti_Pembayaran - BUKTI BAYAR KONFERWIL.jpeg', 'F0028', '1'),
(23, 'MUHAMMAD, S.H., M.Kn.', 'SIDOARJO', '499034', '03-01-2022', 'MUHAMMAD, S.H., M.Kn.- Bukti_Pembayaran - bca.jpeg', 'M0034', '1'),
(24, 'SYEH, SH', 'SUMENEP', '499037', '03-01-2022', 'SYEH, SH- Bukti_Pembayaran - WhatsApp Image 2022-01-03 at 12.16.50.jpeg', 'S0037', '1'),
(25, 'ALBERT EUDORA CHANDRA, SH., MK.N', 'LAMONGAN', '499031', '03-01-2022', 'ALBERT EUDORA CHANDRA, SH., MK.N- Bukti_Pembayaran - 16411882575112229464178114248116.jpg', 'A0031', '1'),
(26, 'IYEN SUHESTI, S.H.', 'SURABAYA', '499032', '03-01-2022', 'IYEN SUHESTI, S.H.- Bukti_Pembayaran - MBRC_1641184019295.png', 'I0032', '1'),
(27, 'LILIEK SUSTAFIANA, S.H.', 'SURABAYA', '499024', '03-01-2022', 'LILIEK SUSTAFIANA, S.H.- Bukti_Pembayaran - IMG_20220103_124551.jpg', 'L0024', '1'),
(28, 'LITA CAHAYANI, S.H., M.Kn', 'GRESIK', '499038', '03-01-2022', 'LITA CAHAYANI, S.H., M.Kn- Bukti_Pembayaran - BUKTI BAYAR KONFERWIL 22 JANUARI 2022.jpeg', 'L0038', '1'),
(29, 'PROF. DR. LANNY KUSUMAWATI, DRA., S.H., M.HUM', 'SURABAYA', '499039', '03-01-2022', 'PROF. DR. LANNY KUSUMAWATI, DRA., S.H., M.HUM- Bukti_Pembayaran - Bukti bayar konferwil 2022.jpg', 'P0039', '1'),
(30, 'FACHRIA LAPASERE, S.H.', 'SURABAYA', '499036', '03-01-2022', 'FACHRIA LAPASERE, S.H.- Bukti_Pembayaran - D47DF6E1-2AE0-4BDE-B950-9AF00DB2E6D7.jpeg', 'F0036', '1'),
(31, 'SAMIRAN, S.H., M.M., M.H., M.Kn', 'KOTA BATU', '499033', '03-01-2022', 'SAMIRAN, S.H., M.M., M.H., M.Kn- Bukti_Pembayaran - IMG_20220103_131108.jpg', 'S0033', '1'),
(32, 'WIBOWO IBO SARWONO, S.H.,M.Kn.', 'SURABAYA', '499035', '03-01-2022', 'WIBOWO IBO SARWONO, S.H.,M.Kn.- Bukti_Pembayaran - BUKTI TF PAK WIBOWO KONFERWIL.jpg', 'W0035', '1'),
(33, 'LIEK WAHYUNINGSIH, SH', 'KAB MADIUN', '499026', '03-01-2022', 'LIEK WAHYUNINGSIH, SH- Bukti_Pembayaran - BUKTI BAYAR PENDAFTARAN KONFERWIL JATIM IPPAT20220103.pdf', 'L0026', '1'),
(34, 'RADINA LINDAWATI, SH, M.KN', 'SURABAYA', '499041', '03-01-2022', 'RADINA LINDAWATI, SH, M.KN- Bukti_Pembayaran - Screenshot_20220103-140952_BNIMobilenew.jpg', 'R0041', '1'),
(35, 'ENI ZUBAIDAH, SH', 'BOJONEGORO', '499042', '03-01-2022', 'ENI ZUBAIDAH, SH- Bukti_Pembayaran - 16411966065135492258682299959476.jpg', 'E0042', '1'),
(36, 'PUTU AYU EKAPUTRI, SH, M.KN', 'LAMONGAN', '499043', '03-01-2022', 'PUTU AYU EKAPUTRI, SH, M.KN- Bukti_Pembayaran - Bukti bayar konferwil IPPAT 2022.jpeg', 'P0043', '1'),
(37, 'SUNTARI, S.H., M.KN', 'TULUNGAGUNG', '499045', '03-01-2022', 'SUNTARI, S.H., M.KN- Bukti_Pembayaran - BUKTI BAYAR 3-1-2022.jpeg', 'S0045', '1'),
(38, 'DR. MAHDI AHMAD MAHFUD, S.H., M.KN.', 'LAMONGAN', '499047', '04-01-2022', 'DR. MAHDI AHMAD MAHFUD, S.H., M.KN.- Bukti_Pembayaran - bukti bayar.jpg', 'D0047', '1'),
(39, 'SOCHIB ARIFIN, S.H., M.H.', 'SIDOARJO', '499046', '03-01-2022', 'SOCHIB ARIFIN, S.H., M.H.- Bukti_Pembayaran - BUKTI BAYAR KONFERWIL.jpg', 'S0046', '1'),
(40, 'GATOT TRIWALUYO, S.H., M.Kn.', 'SURABAYA', '499019', '04-01-2022', 'GATOT TRIWALUYO, S.H., M.Kn.- Bukti_Pembayaran - WhatsApp Image 2022-01-04 at 10.04.46.jpeg', 'G0019', '1'),
(41, 'YULIUS EFENDI, SH., M.Kn.', 'SITUBONDO', '499049', '04-01-2022', 'YULIUS EFENDI, SH., M.Kn.- Bukti_Pembayaran - BAYAR KONFERWIL IPPAT.jpeg', 'Y0049', '1'),
(42, 'HJ. MASRUROH, S.H., M.Kn.', 'JOMBANG', '499048', '04-01-2022', 'HJ. MASRUROH, S.H., M.Kn.- Bukti_Pembayaran - IMG_20220104_113541.jpg', 'H0048', '1'),
(43, 'TINTRIM HANDAJANI, SH.M.KN.', 'GRESIK', '499053', '04-01-2022', 'TINTRIM HANDAJANI, SH.M.KN.- Bukti_Pembayaran - 9CAF381B-A04B-438B-A6FF-68FF340A730F.png', 'T0053', '1'),
(44, 'ASRIE DWI JAYANTI, S.H.,M.Kn.', 'TUBAN', '499057', '04-01-2022', 'ASRIE DWI JAYANTI, S.H.,M.Kn.- Bukti_Pembayaran - 31854BBB-98F5-4493-B118-94F0488ACBF6.png', 'A0057', '1'),
(45, 'DIAN SILVIANA KHUSNARINI, S.H.', 'SURABAYA', '499051', '04-01-2022', 'DIAN SILVIANA KHUSNARINI, S.H.- Bukti_Pembayaran - Bukti transfer BNI Konferwil Jatim.pdf', 'D0051', '1'),
(46, 'INDAH SUPRAPTIWI, SH., M.Kn', 'LAMONGAN', '499056', '04-01-2022', 'INDAH SUPRAPTIWI, SH., M.Kn- Bukti_Pembayaran - IMG-20220104-WA0012.jpg', 'I0056', '1'),
(47, 'ENITA, S.H., M.KN.', 'KAB KEDIRI', '499059', '04-01-2022', 'ENITA, S.H., M.KN.- Bukti_Pembayaran - WhatsApp Image 2022-01-04 at 14.58.20.jpeg', 'E0059', '1'),
(48, 'SABRINA ASKANDAR TJOKROPRAWIRO, S.H., M.Kn.', 'SURABAYA', '499060', '04-01-2022', 'SABRINA ASKANDAR TJOKROPRAWIRO, S.H., M.Kn.- Bukti_Pembayaran - BUKTI SETOR KONFERWIL 2022.jpeg', 'S0060', '1'),
(49, 'RIZKI SUKMA HAPSARI, S.H., M.KN', 'KOTA MADIUN', '499061', '04-01-2022', 'RIZKI SUKMA HAPSARI, S.H., M.KN- Bukti_Pembayaran - IMG-20220104-WA0012.jpg', 'R0061', '1'),
(50, 'KUSRINI PURWIJANTI, S.H.', 'SURABAYA', '499063', '04-01-2022', 'KUSRINI PURWIJANTI, S.H.- Bukti_Pembayaran - Bukti bayar ippat 04-1-22.jpeg', 'K0063', '1'),
(51, 'DADANG AGUS SETIAWAN, S.H., M.KN.', 'LUMAJANG', '499064', '04-01-2022', 'DADANG AGUS SETIAWAN, S.H., M.KN.- Bukti_Pembayaran - BUKTI BAYAR KONFERWIL IPPAT.jpeg', 'D0064', '1'),
(52, 'MIKE ERVIANA,S.H.,M.Kn', 'NGANJUK', '499055', '04-01-2022', 'MIKE ERVIANA,S.H.,M.Kn- Bukti_Pembayaran - BUKTI BAYAR MIKE ERVIANA.jpeg', 'M0055', '1'),
(53, 'IHO SURMA, S.H., M.Kn', 'GRESIK', '499061', '04-01-2022', 'IHO SURMA, S.H., M.Kn- Bukti_Pembayaran - CA5AEB5C-BC74-4752-84DE-DEC3DF8C1E43.jpeg', 'I0061', '1'),
(54, 'RUDY EFFENDI, S.H.', 'SURABAYA', '499066', '05-01-2022', 'RUDY EFFENDI, S.H.- Bukti_Pembayaran - InitiateSingleEntryPaymentSummary05-01-2022.pdf', 'R0066', '1'),
(55, 'CITRA AWALIA FARNANDA, SH., M.Kn.', 'PASURUAN', '499052', '05-01-2022', 'CITRA AWALIA FARNANDA, SH., M.Kn.- Bukti_Pembayaran - bukti bayar.jpeg', 'C0052', '1'),
(56, 'SITI MUNDIROH, S.H., M.HUM., M.Kn.', 'SIDOARJO', '499069', '05-01-2022', 'SITI MUNDIROH, S.H., M.HUM., M.Kn.- Bukti_Pembayaran - WhatsApp Image 2022-01-05 at 09.20.07.jpeg', 'S0069', '1'),
(57, 'SHERLY DIAN MEIRAWATI, SH., MH', 'SURABAYA', '499065', '05-01-2022', 'SHERLY DIAN MEIRAWATI, SH., MH- Bukti_Pembayaran - a57feb32-cb53-491d-91de-b350760e652e.jpg', 'S0065', '1'),
(58, 'ZAHIRAH BACHMID, SH.', 'PASURUAN', '499070', '05-01-2022', 'ZAHIRAH BACHMID, SH.- Bukti_Pembayaran - Bukti Byar Konferwil.jpeg', 'Z0070', '1'),
(59, 'DR. H. ZAENAL ARIFIN, S.H., M.HUM', 'BLITAR', '499068', '05-01-2022', 'DR. H. ZAENAL ARIFIN, S.H., M.HUM- Bukti_Pembayaran - bukti pembayaran konferensi.jpg', 'D0068', '1'),
(60, 'ANITA ANGGAWIJAYA, S.H.', 'SURABAYA', '499071', '05-01-2022', 'ANITA ANGGAWIJAYA, S.H./ANITA NGGAWIDJAJA, S.H.- Bukti_Pembayaran - BUKTI BAYAR.jpeg', 'A0071', '1'),
(61, 'RONALD JUANDA HOLSEN, SH, M.KN', 'SURABAYA', '499072', '05-01-2022', 'RONALD JUANDA HOLSEN, SH, M.KN- Bukti_Pembayaran - Screenshot_20220105-101032_WhatsApp.jpg', 'R0072', '1'),
(62, 'ERWIN SUHARDIMAN, S.SOS, SH, M.Kn', 'KABUPATEN MALANG', '499054', '05-01-2022', 'ERWIN SUHARDIMAN, S.SOS, SH, M.Kn- Bukti_Pembayaran - IMG-20220105-WA0014.jpg', 'E0054', '1'),
(63, 'MARIA MONICA IRA KOESVITASARI,S.H.', 'SURABAYA', '499077', '05-01-2022', 'MARIA MONICA IRA KOESVITASARI,S.H.- Bukti_Pembayaran - Screenshot 2022-01-05 at 10-54-28 Flip Transfer Beda Bank Tanpa Biaya Admin .png', 'M0077', '1'),
(64, 'MUHAMMAD MUHAROR HABIBI', 'KOTA BATU', '499075', '05-01-2022', 'MUHAMMAD MUHAROR HABIBI- Bukti_Pembayaran - Bukti Bayar.pdf', 'M0075', '1'),
(65, 'HILDA RACHMAWATI, S.H.', 'SIDOARJO', '499081', '05-01-2022', 'HILDA RACHMAWATI, S.H.- Bukti_Pembayaran - ACB816C6-37C9-440E-8A6D-835852E286FA.jpeg', 'H0081', '1'),
(66, 'ISTER ANGELIA, SH., M.Kn', 'LAMONGAN', '499025', '05-01-2022', 'ISTER ANGELIA, SH., M.Kn- Bukti_Pembayaran - bukti bayar.jpeg', 'I0025', '1'),
(67, 'H. MASRUCHIN, S.H., SP.N., M.HUM.', 'JOMBANG', '499029', '04-01-2022', 'H. MASRUCHIN, S.H., SP.N., M.HUM.- Bukti_Pembayaran - WhatsApp Image 2022-01-05 at 11.48.46.jpeg', 'H0029', '1'),
(68, 'ATIKA ASHIBLIE, S.H.', 'SURABAYA', '499086', '05-01-2022', 'ATIKA ASHIBLIE, S.H.- Bukti_Pembayaran - bukti tf.jpeg', 'A0086', '1'),
(69, 'SITI MUNAWAROH, S.H., M.Kn.', 'SIDOARJO', '499062', '05-01-2022', 'SITI MUNAWAROH, S.H., M.Kn.- Bukti_Pembayaran - Bukti Bayar konferwil IPPAT Jatim.jpg', 'S0062', '1'),
(70, 'YATININGSIH, SH. MH.', 'SURABAYA', '499076', '05-01-2022', 'YATININGSIH, SH. MH.- Bukti_Pembayaran - bukti bayar ippat.jpeg', 'Y0076', '1'),
(71, 'ISWI ARTATI, SH', 'SURABAYA', '499087', '05-01-2022', 'ISWI ARTATI, SH- Bukti_Pembayaran - Bukti bayar.jpeg', 'I0087', '1'),
(72, 'MUNTAFIAH, SH., M.Kn', 'TUBAN', '499084', '05-01-2022', 'MUNTAFIAH, SH., M.Kn- Bukti_Pembayaran - bukti byar muntafiah.jpeg', 'M0084', '1'),
(73, 'ENDAHINGSIH WIJAYANTI, S.H., M.Kn.', 'JOMBANG', '499044', '05-01-2022', 'ENDAHINGSIH WIJAYANTI, S.H., M.Kn.- Bukti_Pembayaran - IMG-20220105-WA0009.jpg', 'E0044', '1'),
(74, 'TAUFIQ HIDAYAT, SH,. M.Kn.', 'PROBOLINGGO', '499090', '05-01-2022', 'TAUFIQ HIDAYAT, SH,. M.Kn.- Bukti_Pembayaran - BUKTI PEMBAYARAN.jpeg', 'T0090', '1'),
(75, 'LUCIA SURYANI WIDJOJO, S.H.', 'SURABAYA', '499091', '05-01-2022', 'LUCIA SURYANI WIDJOJO, S.H.- Bukti_Pembayaran - BUKTI BAYAR KONFERWIL LUCIA SURYANI WIDJOJO SH.jpeg', 'L0091', '1'),
(76, 'MUHAMMAD DWI RIZYAN, SH., M.Kn', 'BLITAR', '499085', '05-01-2022', 'MUHAMMAD DWI RIZYAN, SH., M.Kn- Bukti_Pembayaran - bukti bayar konferwil.jpeg', 'M0085', '1'),
(77, 'DANIEL HARYANTO,S.H.,M.Kn', 'NGANJUK', '499074', '05-01-2022', 'DANIEL HARYANTO,S.H.,M.Kn- Bukti_Pembayaran - bukti bayar.jpg', 'D0074', '1'),
(78, 'BAGOES SETYO NUGROHO, S.H., M.Kn.', 'KOTA MALANG', '499058', '05-01-2022', 'BAGOES SETYO NUGROHO, S.H., M.Kn.- Bukti_Pembayaran - IMG-20220105-WA0010.jpg', 'B0058', '1'),
(79, 'NIKEN RAHAYU, S.H., M.KN', 'TULUNGAGUNG', '499092', '05-01-2022', 'NIKEN RAHAYU, S.H., M.KN- Bukti_Pembayaran - Bukti Bayar KONFERWIL JATIM.pdf', 'N0092', '1'),
(80, 'H. MOHAMMAD ANAS NASHRUDDIN, S.H., M.KN', 'TULUNGAGUNG', '499093', '05-01-2022', 'H. MOHAMMAD ANAS NASHRUDDIN, S.H., M.KN- Bukti_Pembayaran - MBRC_1641369074225.png', 'H0093', '1'),
(81, 'HAJJAH SITI REYNAR, SH', 'LAMONGAN', '499030', '03-01-2022', 'HAJJAH SITI REYNAR, SH- Bukti_Pembayaran - BUKTI BAYAR.pdf', 'H0030', '1'),
(82, 'INAS ABDULLAH THALIB, SH.', 'GRESIK', '499094', '05-01-2022', 'INAS ABDULLAH THALIB, SH.- Bukti_Pembayaran - IMG-20220105-WA0025.jpg', 'I0094', '1'),
(83, 'YUKE ARIYANTI, S.H., M.Kn.', 'JOMBANG', '499040', '05-01-2022', 'YUKE ARIYANTI, S.H., M.Kn.- Bukti_Pembayaran - 16413713529408737786311127907620.jpg', 'Y0040', '1'),
(84, 'AGUS KURNIAWAN , SH., M.Kn.', 'BANGKALAN', '499097', '05-01-2022', 'AGUS KURNIAWAN , SH., M.Kn.- Bukti_Pembayaran - IMG_20220105_173913.jpg', 'A0097', '1'),
(85, 'RIF`ATUL KHUSNIA, SH., M.Kn.', 'PASURUAN', '499067', '05-01-2022', 'RIF`ATUL KHUSNIA, SH., M.Kn.- Bukti_Pembayaran - WhatsApp Image 2022-01-05 at 20.04.52.jpeg', 'R0067', '1'),
(86, 'USNAENY ULY AZIS', 'SURABAYA', '499100', '06-01-2022', 'USNAENY ULY AZIS- Bukti_Pembayaran - 545AF170-BDBD-46DE-B4E0-D51454B52D13.jpeg', 'U0100', '1'),
(87, 'KUSUMA HANGGARWATI, S.H., M.KN.', 'LAMONGAN', '499101', '06-01-2022', 'KUSUMA HANGGARWATI, S.H., M.KN.- Bukti_Pembayaran - 04A9812C-08AE-42F6-BC8A-6120A56A2EDC.jpeg', 'K0101', '1'),
(88, 'RINA RUSTIANINGWARNI, SH', 'SURABAYA', '499095', '06-01-2022', 'RINA RUSTIANINGWARNI, SH- Bukti_Pembayaran - bukti tranfer.pdf', 'R0095', '1'),
(89, 'SRI AMPENI SWANDAYANI, SH', 'SURABAYA', '499106', '06-01-2022', 'SRI AMPENI SWANDAYANI, SH- Bukti_Pembayaran - BUKTI BAYAR.jpeg', 'S0106', '1'),
(90, 'RANTY ARTSILIA, SH', 'SURABAYA', '499104', '06-01-2022', 'RANTY ARTSILIA, SH- Bukti_Pembayaran - bukti tf ippat ranty artsilia.docx', 'R0104', '1'),
(91, 'HJ. SUFIE ETHIKA, S.H.', 'JOMBANG', '499103', '06-01-2022', 'HJ. SUFIE ETHIKA, S.H.- Bukti_Pembayaran - BUKTI BAYAR KONFERWIL JATIM IPPAT.doc', 'H0103', '1'),
(92, 'PENY CANDRA WARDANI, S.H., M.Kn', 'SIDOARJO', '499108', '06-01-2022', 'PENY CANDRA WARDANI, S.H., M.Kn- Bukti_Pembayaran - Bukti Bayar.jpg', 'P0108', '1'),
(93, 'INDRIA SETIAWATI, SH., M.Kn.', 'PASURUAN', '499096', '06-01-2022', 'INDRIA SETIAWATI, SH., M.Kn.- Bukti_Pembayaran - Bukti bayar konferwil INDRIA 22 jan 22.jpeg', 'I0096', '1'),
(94, 'AKHMAD FAIZAL RIZANI, SH., M.Kn', 'SUMENEP', '499110', '06-01-2022', 'AKHMAD FAIZAL RIZANI, SH., M.Kn- Bukti_Pembayaran - WhatsApp Image 2022-01-06 at 09.46.57.jpeg', 'A0110', '1'),
(95, 'ZAHRULLAH AMROZI JOHAR, S.H.', 'SURABAYA', '499105', '06-01-2022', 'ZAHRULLAH AMROZI JOHAR, S.H.- Bukti_Pembayaran - BUKTI BAYAR KONFERWIL AMROZI JOHAR,SH.jpeg', 'Z0105', '1'),
(96, 'DEDY IMRON MAHA PUTRA, S.H., M.Kn.', 'KOTA MADIUN', '499098', '06-01-2022', 'DEDY IMRON MAHA PUTRA, S.H., M.Kn.- Bukti_Pembayaran - WhatsApp Image 2022-01-06 at 9.36.44 AM.jpeg', 'D0098', '1'),
(97, 'SRIWATI, S.H., M.HUM.', 'SIDOARJO', '499112', '06-01-2022', 'SRIWATI, S.H., M.HUM.- Bukti_Pembayaran - WhatsApp Image 2022-01-06 at 10.02.39.jpeg', 'S0112', '1'),
(98, 'ANY UMAYA, S.H., M.Kn.', 'SIDOARJO', '499107', '06-01-2022', 'ANY UMAYA, S.H., M.Kn.- Bukti_Pembayaran - BUKTI BAYAR an ANY UMAYA, SH, MKN.jpeg', 'A0107', '1'),
(99, 'EKA NOVA LINDA, S.H., M.Kn.', 'SIDOARJO', '499115', '06-01-2022', 'EKA NOVA LINDA, S.H., M.Kn.- Bukti_Pembayaran - BUKTI BAYAR KONFERWIL.jpeg', 'E0115', '1'),
(100, 'DWI ROSSULLIATI, S.H.', 'MOJOKERTO', '499114', '06-01-2022', 'DWI ROSSULLIATI, S.H.- Bukti_Pembayaran - BUKTI TF 500RB.jpg', 'D0114', '1'),
(101, 'MOHAMMAD BUDI PAHLAWAN SH', 'SURABAYA', '499118', '06-01-2022', 'MOHAMMAD BUDI PAHLAWAN SH- Bukti_Pembayaran - HISTORI TRANSAKSI.pdf', 'M0118', '1'),
(102, 'ARPA SYURA TAMBUNO, SH,M.Kn', 'KAB MADIUN', '499109', '06-01-2022', 'ARPA SYURA TAMBUNO, SH,M.Kn- Bukti_Pembayaran - Bukti pembayaran Arpa.pdf', 'A0109', '1'),
(103, 'SITI SOFIYAH, SH, M.Kn', 'KABUPATEN MALANG', '499119', '06-01-2022', 'SITI SOFIYAH, SH, M.Kn- Bukti_Pembayaran - BUKTI BAYAR KONFERWIL PPAT.jpeg', 'S0119', '1'),
(104, 'SANTI MINA, S.H., M.Kn.', 'SIDOARJO', '499078', '06-01-2022', 'SANTI MINA, S.H., M.Kn.- Bukti_Pembayaran - BUKTI BAYAR SEMINAR.jpeg', 'S0078', '1'),
(105, 'ROBERTA RINJANI SUNDARI, S.H., M.Kn', 'TUBAN', '499116', '06-01-2022', 'ROBERTA RINJANI SUNDARI, S.H., M.Kn- Bukti_Pembayaran - bukti bayar .jpeg', 'R0116', '1'),
(106, 'CHRISTYANI KUSUMANINGTYAS, S.H., M.KN', 'PAMEKASAN', '499121', '06-01-2022', 'CHRISTYANI KUSUMANINGTYAS, S.H., M.KN- Bukti_Pembayaran - BUKTI BAYAR KONFERWIL IPPAT 2022.jpg', 'C0121', '1'),
(107, 'DR. MIANDO P. PARAPAT, S.H., SPN.,M.HUM.', 'KAB KEDIRI', '499122', '06-01-2022', 'DR. MIANDO P. PARAPAT, S.H., SPN.,M.HUM.- Bukti_Pembayaran - WhatsApp Image 2022-01-06 at 12.11.54.jpeg', 'D0122', '1'),
(108, 'BUDI RAHARJO, SH.', 'SURABAYA', '499123', '06-01-2022', 'BUDI RAHARJO, SH.- Bukti_Pembayaran - Screenshot_20220106-120412_BNIMobilenew.jpg', 'B0123', '1'),
(109, 'ERMIN YUNIASTUTI, S.H.', 'SIDOARJO', '499125', '06-01-2022', 'ERMIN YUNIASTUTI, S.H.- Bukti_Pembayaran - WhatsApp Image 2022-01-06 at 12.20.59.jpeg', 'E0125', '1'),
(110, 'ARDY KURNIAWAN, SH., M.KN.', 'PASURUAN', '499126', '06-01-2022', 'ARDY KURNIAWAN, SH., M.KN.- Bukti_Pembayaran - Bukti Transfer.pdf', 'A0126', '1'),
(111, 'TRI SINTA KRISNANINGRUM, S.H., M.Kn.', 'SIDOARJO', '499099', '05-01-2022', 'TRI SINTA KRISNANINGRUM, S.H., M.Kn.- Bukti_Pembayaran - BUKTI TRANSFER TRI SINTA KRISNANINGRUM, S.H., M.Kn..jpeg', 'T0099', '1'),
(112, 'DR. R. IBNU ARLY, S.H., M.KN.', 'SURABAYA', '499128', '06-01-2022', 'DR. R. IBNU ARLY, S.H., M.KN.- Bukti_Pembayaran - WhatsApp Image 2022-01-06 at 13.12.30.jpeg', 'D0128', '1'),
(113, 'KIKA MARYANTIKA, S.H., M.Kn.', 'SURABAYA', '499082', '06-01-2022', 'KIKA MARYANTIKA, S.H., M.Kn.- Bukti_Pembayaran - WhatsApp Image 2022-01-06 at 13.47.32 (1).jpeg', 'K0082', '1'),
(114, 'ENDRAWATI, S.H., M.KN.', 'SIDOARJO', '499129', '06-01-2022', 'ENDRAWATI, S.H., M.KN.- Bukti_Pembayaran - bukti bayar konferwil.jpeg', 'E0129', '1'),
(115, 'INGGIL NUGROHO WASIH, S.H.', 'SIDOARJO', '499133', '06-01-2022', 'INGGIL NUGROHO WASIH, S.H.- Bukti_Pembayaran - bukti transfer pendaftaran an. inggil nugroho wasih.jpeg', 'I0133', '1'),
(116, 'MARIA ULFAH, SH., M.KN.', 'PASURUAN', '499132', '06-01-2022', 'MARIA ULFAH, SH., M.KN.- Bukti_Pembayaran - IMG20220106161852.jpg', 'M0132', '1'),
(117, 'WIDYANANDA ALTRIARA MAHARANI, SH. M.KN', 'GRESIK', '499136', '06-01-2022', 'WIDYANANDA ALTRIARA MAHARANI, SH. M.KN- Bukti_Pembayaran - WhatsApp Image 2022-01-06 at 16.37.08.jpeg', 'W0136', '1'),
(118, 'SRI SUHERSI RAHAYU, S.H., M.H.', 'SURABAYA', '499134', '06-01-2022', 'SRI SUHERSI RAHAYU, S.H., M.H.- Bukti_Pembayaran - WhatsApp Image 2022-01-06 at 16.56.31.jpeg', 'S0134', '1'),
(119, 'DYAH AYU KUSUMANINGTYAS, S.H., M.Kn.', 'SIDOARJO', '499080', '06-01-2022', 'DYAH AYU KUSUMANINGTYAS, S.H., M.Kn.- Bukti_Pembayaran - IMG-20220106-WA0085.jpg', 'D0080', '1'),
(120, 'TRISNAWATI, S.H., M.Kn.', 'PASURUAN', '499138', '07-01-2022', 'TRISNAWATI, S.H., M.Kn.- Bukti_Pembayaran - -6249176771891146292_120.jpg', 'T0138', '1'),
(121, 'NURWANTI WAKIDAH, S.H., M.Kn', 'TULUNGAGUNG', '499124', '06-01-2022', 'NURWANTI WAKIDAH, S.H., M.Kn- Bukti_Pembayaran - WhatsApp Image 2022-01-07 at 10.00.26.jpeg', 'N0124', '1'),
(122, 'WAHYUNI ANDARUKMI, SH., M.Kn', 'PACITAN', '499120', '07-01-2022', 'WAHYUNI ANDARUKMI, SH., M.Kn- Bukti_Pembayaran - bukti bayar.pdf', 'W0120', '1'),
(123, 'EVY RETNO BUIARTY, S.H., M.KN.', 'SURABAYA', '499142', '07-01-2022', 'EVY RETNO BUIARTY, S.H., M.KN.- Bukti_Pembayaran - WhatsApp Image 2022-01-07 at 10.38.32.jpeg', 'E0142', '1'),
(124, 'AMANDA PUSPITA, SH. M.KN.', 'GRESIK', '499141', '07-01-2022', 'AMANDA PUSPITA, SH. M.KN.- Bukti_Pembayaran - bukti transfer..png', 'A0141', '1'),
(125, 'NUR AINI, SH., M.KN', 'SUMENEP', '499146', '07-01-2022', 'NUR AINI, SH., M.KN- Bukti_Pembayaran - 16415289708512153612339852071943.jpg', 'N0146', '1'),
(126, 'SITI ANGGRAENIE HAPSARI, S.H.,M.H.', 'SURABAYA', '499140', '07-01-2022', 'SITI ANGGRAENIE HAPSARI, S.H.,M.H.- Bukti_Pembayaran - Bukti Bayar Konferwil PPAT.jpeg', 'S0140', '1'),
(127, 'ANNA EKOWATI, SH, M.Kn.', 'SIDOARJO', '499127', '07-01-2022', 'ANNA EKOWATI, SH, M.Kn.- Bukti_Pembayaran - BUKTI TRANSFER KONFERWIL.pdf', 'A0127', '1'),
(128, 'ILUMINATIA PENY, SH. M.Kn.', 'PASURUAN', '499137', '07-01-2022', 'ILUMINATIA PENY, SH. M.Kn.- Bukti_Pembayaran - BUKTI BAYAR KONFERWIL 2022.jpeg', 'I0137', '1'),
(129, 'EMY ZUHRA, S.H., SP.N', 'JOMBANG', '499135', '07-01-2022', 'EMY ZUHRA, S.H., SP.N- Bukti_Pembayaran - IMG-20220107-WA0003.jpg', 'E0135', '1'),
(130, 'WAHYU ELMA NAF`AN, SH., M.Kn', 'KAB. JEMBER & KAB. BONDOWOSO', '499113', '07-01-2022', 'WAHYU ELMA NAF`AN, SH., M.Kn- Bukti_Pembayaran - BUKTI BAYAR KONFERWIL.jpg', 'W0113', '1'),
(131, 'SAIFUL MUNIR, S.H.', 'SIDOARJO', '499143', '07-01-2022', 'SAIFUL MUNIR, S.H.- Bukti_Pembayaran - BUKTI BAYAR KONFERWIL 2022.jpg', 'S0143', '1'),
(132, 'ELMI SASMITANINGTYAS, SH, M.KN', 'KABUPATEN MALANG', '499151', '07-01-2022', 'ELMI SASMITANINGTYAS, SH, M.KN- Bukti_Pembayaran - Screenshot_2022-01-07-14-41-14-82_e8205ec1cda7e9657fadf502be9b7b78.jpg', 'E0151', '1'),
(133, 'SUSI EKOWATI, S.PSI., S.H., M.KN.', 'JOMBANG', '499152', '07-01-2022', 'SUSI EKOWATI, S.PSI., S.H., M.KN.- Bukti_Pembayaran - eyJpdiI6InlLOTdRRHFtYTFYb1o5V29jSDVJS1E9PSIsInZhbHVlIjoibzV0UmloaVVsU2lPNXdvVDJBUHE1UT09IiwibWFjIjoiYmYxYTZlNmE1ZjBjMTRkNDU1ZGNhOGQxZTJjOGRlYjQyMzIxYTljMWRkZGZkZDYxYTIyOTU3Zjg4OGMyNjBhMiJ9.pdf', 'S0152', '1'),
(134, 'DR. DIAH AJU WISNUWARDHANI, S.H, M.HUM', 'KOTA MALANG', '499153', '07-01-2022', 'DR. DIAH AJU WISNUWARDHANI, S.H, M.HUM- Bukti_Pembayaran - WhatsApp Image 2022-01-07 at 3.47.44 PM.jpeg', 'D0153', '1'),
(135, 'CHRISTIANA EKA SETYAWARDHANI, S.H', 'SURABAYA', '499150', '07-01-2022', 'CHRISTIANA EKA SETYAWARDHANI, S.H- Bukti_Pembayaran - MBRC_1641544459563 (1)-converted.pdf', 'C0150', '1'),
(136, 'SRI ARENI, S.H., M.M', 'TULUNGAGUNG', '499155', '07-01-2022', 'SRI ARENI, S.H., M.M- Bukti_Pembayaran - IMG-20220107-WA0005.jpg', 'S0155', '1'),
(137, 'YUDHISTIRA CAHYONO, SH, M.Kn', 'SITUBONDO', '499154', '07-01-2022', 'YUDHISTIRA CAHYONO, SH, M.Kn- Bukti_Pembayaran - Screenshot_20220108-084619_WhatsApp.jpg', 'Y0154', '1'),
(138, 'RACHMAWATI UTAMI, SH., M.KN', 'PROBOLINGGO', '499159', '08-01-2022', 'RACHMAWATI UTAMI, SH., M.KN- Bukti_Pembayaran - Screenshot_20220108_095359.jpg', 'R0159', '1'),
(139, 'ARI ISTIQOMAH,SH', 'SIDOARJO', '499157', '08-01-2022', 'ARI ISTIQOMAH,SH- Bukti_Pembayaran - IMG-20220108-WA0004.jpg', 'A0157', '1'),
(140, 'ILHAM SETYADI, SH., M.Kn', 'MAGETAN', '499156', '08-01-2022', 'ILHAM SETYADI, SH., M.Kn- Bukti_Pembayaran - WhatsApp Image 2022-01-08 at 10.32.45.jpeg', 'I0156', '1'),
(141, 'ACHMAD FIKRI HIDAYAT', 'SIDOARJO', '499161', '08-01-2022', 'ACHMAD FIKRI HIDAYAT- Bukti_Pembayaran - bukti bayar ippat.jpg', 'A0161', '1'),
(142, 'ADHISTY SITARESMI, S.H., M.Kn.', 'SIDOARJO', '499158', '08-01-2022', 'ADHISTY SITARESMI, S.H., M.Kn.- Bukti_Pembayaran - WhatsApp Image 2022-01-08 at 12.23.55.jpeg', 'A0158', '1'),
(143, 'AYUB SUPARTO, SH., MK.N.', 'KOTA MADIUN', '499162', '08-01-2022', 'AYUB SUPARTO, SH., MK.N.- Bukti_Pembayaran - BUKTI PEMBAYARAN AYUB.jpg', 'A0162', '1'),
(144, 'NURUL AVIVA HERAWATI SARI, SH, M.KN.', 'KEDIRI', '499163', '08-01-2022', 'NURUL AVIVA HERAWATI SARI, SH, M.KN.- Bukti_Pembayaran - IMG-20220108-WA0073.jpg', 'N0163', '1'),
(145, 'DENNY IRTANTO,S.H.,M.KN', 'LUMAJANG', '499164', '08-01-2022', 'DENNY IRTANTO,S.H.,M.KN- Bukti_Pembayaran - Image-1.jpg', 'D0164', '1'),
(146, 'ELVARETA BAYU NAKTIKA, SH., M.Kn.', 'BANGKALAN', '499131', '09-01-2022', 'ELVARETA BAYU NAKTIKA, SH., M.Kn.- Bukti_Pembayaran - Screenshot_20220109-073238_BCA mobile.jpg', 'E0131', '1'),
(147, 'YUSTIANA, S.H.', 'SURABAYA', '499130', '08-01-2022', 'YUSTIANA, S.H.- Bukti_Pembayaran - SAVE_20220109_143314.jpg', 'Y0130', '1'),
(148, 'SUTAN RACHMAN SALEH, SH', 'SIDOARJO', '499166', '09-01-2022', 'SUTAN RACHMAN SALEH, SH- Bukti_Pembayaran - Screenshot_20220109-152618_BCA mobile.jpg', 'S0166', '1'),
(149, 'DR. DAVID HARDJO, SH., M.H., M.Kn.', 'GRESIK', '499165', '09-01-2022', 'DR. DAVID HARDJO, SH., M.H., M.Kn.- Bukti_Pembayaran - 9B27FF06-5CEA-48C7-8F35-5F634820F12C.jpeg', 'D0165', '1'),
(150, 'ATIN TRI BUDIYANI, S.H., M.Kn.', 'SIDOARJO', '499145', '08-01-2022', 'ATIN TRI BUDIYANI, S.H., M.Kn.- Bukti_Pembayaran - WhatsApp Image 2022-01-08 at 10.05.16.jpeg', 'A0145', '1'),
(151, 'LOESIANNA, S.H., MBA., M.KN.', 'PASURUAN', '499168', '10-01-2022', 'LOESIANNA, S.H., MBA., M.KN.- Bukti_Pembayaran - Screenshot_20220110-093524_BCA mobile.jpg', 'L0168', '1'),
(152, 'ROSIDA, S.H.', 'SURABAYA', '499169', '10-01-2022', 'ROSIDA, S.H.- Bukti_Pembayaran - BUKTI BAYAR.jpg', 'R0169', '1'),
(153, 'EIS FITRIYANA MAHMUD, SH., M.KN.', 'PASURUAN', '499171', '10-01-2022', 'EIS FITRIYANA MAHMUD, SH., M.KN.- Bukti_Pembayaran - WhatsApp Image 2022-01-10 at 11.06.12.jpeg', 'E0171', '1'),
(154, 'MURTI HARTINI, SH., M.Kn', 'TUBAN', '499173', '10-01-2022', 'MURTI HARTINI, SH., M.Kn- Bukti_Pembayaran - IMG-20220110-WA0018.jpg', 'M0173', '1'),
(155, 'YOVITA DAMAYANTI, S.H., M.H.', 'SURABAYA', '499174', '10-01-2022', 'YOVITA DAMAYANTI, S.H., M.H.- Bukti_Pembayaran - BUKTI BAYAR.jpeg', 'Y0174', '1'),
(156, 'ERITNA SISKA, S.H., M.Kn.', 'KAB KEDIRI', '499178', '10-01-2022', 'ERITNA SISKA, S.H., M.Kn.- Bukti_Pembayaran - BUKTI SETOR.jpeg', 'E0178', '1'),
(157, 'ERVAN SANTOSO, S.H., M.KN.', 'SIDOARJO', '499181', '10-01-2022', 'ERVAN SANTOSO, S.H., M.KN.- Bukti_Pembayaran - Screenshot_20220110-140240.png', 'E0181', '1'),
(158, 'ANNA YULIANTINI, SH.', 'KEDIRI', '499176', '10-01-2022', 'ANNA YULIANTINI, SH.- Bukti_Pembayaran - Bukti Bayar.pdf', 'A0176', '1'),
(159, 'HEROE DJATMIKO, S.H.', 'SIDOARJO', '499180', '10-01-2022', 'HEROE DJATMIKO, S.H.- Bukti_Pembayaran - BUKTI PEMBAYARAN .pdf', 'H0180', '1'),
(160, 'SUKO SETIAWAN, S.H., M.KN.', 'KAB KEDIRI', '499179', '10-01-2022', 'SUKO SETIAWAN, S.H., M.KN.- Bukti_Pembayaran - IMG_7819.jpg', 'S0179', '1'),
(161, 'MARDIANA MARUWI, S.H', 'PONOROGO', '499167', '10-01-2022', 'MARDIANA MARUWI, S.H- Bukti_Pembayaran - BUKTI TRANSFER.jpeg', 'M0167', '1'),
(162, 'WIDIO RAHARDJO, S.H.', 'SURABAYA', '499182', '10-01-2022', 'WIDIO RAHARDJO, S.H.- Bukti_Pembayaran - MBRC_1641810223300.png', 'W0182', '1'),
(163, 'MOCHAMMAD ALI WAHYUDI, S.H.', 'SURABAYA', '499175', '10-01-2022', 'MOCHAMMAD ALI WAHYUDI, S.H.- Bukti_Pembayaran - Screenshot_20220110-183900_BNIMobilenew.jpg', 'M0175', '1'),
(164, 'DANANG ADITYO NUGROHO, SH., MH., M.Kn', 'LAMONGAN', '499079', '10-01-2022', 'DANANG ADITYO NUGROHO, SH., MH., M.Kn- Bukti_Pembayaran - WhatsApp Image 2022-01-10 at 19.38.52.jpeg', 'D0079', '1'),
(165, 'RACHMAH HIDAYATI, SH. M.Kn.', 'GRESIK', '499184', '06-01-2022', 'RACHMAH HIDAYATI, SH. M.Kn.- Bukti_Pembayaran - WhatsApp Image 2022-01-06 at 06.29.25.jpeg', 'R0184', '1'),
(166, 'UMI CHALSUM, S.H., M.Kn.', 'SIDOARJO', '499147', '10-01-2022', 'UMI CHALSUM, S.H., M.Kn.- Bukti_Pembayaran - IMG-20220110-WA0000.jpg', 'U0147', '1'),
(167, 'ETIK PUJI LESTARI, SH., M.Kn.', 'BLITAR', '499177', '10-01-2022', 'ETIK PUJI LESTARI, SH., M.Kn.- Bukti_Pembayaran - IMG-20220110-WA0060.jpg', 'E0177', '1'),
(168, 'FERRY GUNAWAN SH', 'SURABAYA', '499186', '11-01-2022', 'FERRY GUNAWAN SH- Bukti_Pembayaran - Screenshot_20220111-073207_BCA mobile.jpg', 'F0186', '1'),
(169, 'LIA SELVIANA, S.H., M.Kn', 'TULUNGAGUNG', '499073', '10-01-2022', 'LIA SELVIANA, S.H., M.Kn- Bukti_Pembayaran - MBRC_1641800550323.png', 'L0073', '1'),
(170, 'DESSI TAUFANI, S.H., M.Kn.', 'KOTA MALANG', '499050', '04-01-2022', 'DESSI TAUFANI, S.H., M.Kn.- Bukti_Pembayaran - WhatsApp Image 2022-01-11 at 08.59.53 (1).jpeg', 'D0050', '1'),
(171, 'DR. KUKUH MULJO RAHARDJO, SH., M.Kn.', 'SURABAYA', '499192', '11-01-2022', 'DR. KUKUH MULJO RAHARDJO, SH., M.Kn.- Bukti_Pembayaran - IMG-20220111-WA0017.jpg', 'D0192', '1'),
(172, 'NOVI ALISETYORINI, S.H., M.Kn', 'GRESIK', '499183', '11-01-2022', 'NOVI ALISETYORINI, S.H., M.Kn- Bukti_Pembayaran - bukti transfer konferwil IPPAT jatim.pdf', 'N0183', '1'),
(173, 'IDA FARIKHAH, SH., M.KN', 'BOJONEGORO', '499195', '11-01-2022', 'IDA FARIKHAH, SH., M.KN- Bukti_Pembayaran - WhatsApp Image 2022-01-11 at 11.22.09.jpeg', 'I0195', '1'),
(174, 'ANDREAN SAKTI, S.H., M.KN', 'TULUNGAGUNG', '499196', '11-01-2022', 'ANDREAN SAKTI, S.H., M.KN- Bukti_Pembayaran - BUKTI BAYAR KONFERWIL ANDREAN SAKTI.jpg', 'A0196', '1'),
(175, 'ARIESCA DWI APTASARI, S.H., M.Kn.', 'SIDOARJO', '499193', '11-01-2022', 'ARIESCA DWI APTASARI, S.H., M.Kn.- Bukti_Pembayaran - Screenshot_20220111-121333_BCA mobile.jpg', 'A0193', '1'),
(176, 'PROBO NURIASARI, S.H.', 'SURABAYA', '499199', '11-01-2022', 'PROBO NURIASARI, S.H.- Bukti_Pembayaran - TT Upgrading PN.jpeg', 'P0199', '1'),
(177, 'RIZKY ICHWANSAH PUTRA, S.H., M.Kn', 'GRESIK', '499185', '11-01-2022', 'RIZKY ICHWANSAH PUTRA, S.H., M.Kn- Bukti_Pembayaran - Screenshot_2022-01-11-12-18-05-709_com.telkom.mwallet.jpg', 'R0185', '1'),
(178, 'ROFIQ,S.H.,M.KN.', 'KOTA MADIUN', '499202', '11-01-2022', 'ROFIQ,S.H.,M.KN.- Bukti_Pembayaran - WhatsApp Image 2022-01-11 at 12.32.42 PM.jpeg', 'R0202', '1'),
(179, 'DWI WAHYU RAHMAWATI, SH. M.KN.', 'GRESIK', '499201', '11-01-2022', 'DWI WAHYU RAHMAWATI, SH. M.KN.- Bukti_Pembayaran - bukti bayar konferwil dwi.png', 'D0201', '1'),
(180, 'MUHAMMAD SHOLEH, SH.. M.KN', 'LAMONGAN', '499203', '11-01-2022', 'MUHAMMAD SHOLEH, SH.. M.KN- Bukti_Pembayaran - bukti bayar konferwil ms.png', 'M0203', '1'),
(181, 'HERRU PRAMUDIARAMA, S.H., M.KN.', 'SIDOARJO', '499205', '11-01-2022', 'HERRU PRAMUDIARAMA, S.H., M.KN.- Bukti_Pembayaran - Screenshot_20220111-131138766.jpg', 'H0205', '1'),
(182, 'FIRDI ACHMAD ZURKARNAIN, S.H., M.Kn.', 'MOJOKERTO', '499204', '11-01-2022', 'FIRDI ACHMAD ZURKARNAIN, S.H., M.Kn.- Bukti_Pembayaran - BUKTI BAYAR KONFERWIL IPPAT 2022.jpeg', 'F0204', '1'),
(183, 'FARIED, S.H.', 'SURABAYA', '499210', '11-01-2022', 'FARIED, S.H.- Bukti_Pembayaran - bukti byar ppat.jpeg', 'F0210', '1'),
(184, 'ISY KARIMAH SYAKIR, S.H., M.Kn. M.H.', 'SURABAYA', '499190', '11-01-2022', 'ISY KARIMAH SYAKIR, S.H., M.Kn. M.H.- Bukti_Pembayaran - Pembayaran Konferwil Jatim Bu Isy Karimah Syakir.jpeg', 'I0190', '1'),
(185, 'M. ROCKY DIAN, SH., M.KN', 'KAB. JEMBER & KAB. BONDOWOSO', '499211', '11-01-2022', 'M. ROCKY DIAN, SH., M.KN- Bukti_Pembayaran - Screenshot_20220111-145758_BNIMobilenew.jpg', 'M0211', '1'),
(186, 'ANISAH SRI WAHYUNI, SH.', 'KOTA MADIUN', '499206', '11-01-2022', 'ANISAH SRI WAHYUNI, SH.- Bukti_Pembayaran - IMG-20220111-WA0005.jpg', 'A0206', '1'),
(187, 'FIKHA NAILUL MUNA, S.H., M.Kn', 'GRESIK', '499197', '06-01-2022', 'FIKHA NAILUL MUNA, S.H., M.Kn- Bukti_Pembayaran - WhatsApp Image 2022-01-06 at 06.29.25.jpeg', 'F0197', '1'),
(188, 'PUJO ANGGORO KURNIAWAN, S.H., M.Kn.', 'KAB KEDIRI', '499213', '11-01-2022', 'PUJO ANGGORO KURNIAWAN, S.H., M.Kn.- Bukti_Pembayaran - BUKTI BAYAR IPPAT.jpg', 'P0213', '1'),
(189, 'PUSPITA LISTYA NURVIANI, S.H., M.Kn', 'GRESIK', '499188', '10-01-2022', 'PUSPITA LISTYA NURVIANI, S.H., M.Kn- Bukti_Pembayaran - WhatsApp Image 2022-01-06 at 06.29.25.jpeg', 'P0188', '1'),
(190, 'RIKA PERTIWI, S.H., M.Kn', 'GRESIK', '499208', '10-01-2022', 'RIKA PERTIWI, S.H., M.Kn- Bukti_Pembayaran - WhatsApp Image 2022-01-06 at 06.29.25.jpeg', 'R0208', '1'),
(191, 'RAHENDRA KELASWARA, SH., M.Kn.', 'BLITAR', '499214', '11-01-2022', 'RAHENDRA KELASWARA, SH., M.Kn.- Bukti_Pembayaran - img558 (2).jpg', 'R0214', '1'),
(192, 'HADI SOETOPO, S.H, M.Kn.', 'KOTA MOJOKERTO', '499209', '11-01-2022', 'HADI SOETOPO, S.H, M.Kn.- Bukti_Pembayaran - BUKTI BAYAR HADI SOETOPO.jpg', 'H0209', '1'),
(193, 'RIZA MEIJANTO, SH., M.Kn.', 'PASURUAN', '499217', '11-01-2022', 'RIZA MEIJANTO, SH., M.Kn.- Bukti_Pembayaran - Screenshot_2022-01-11-17-15-51-31_6d8b9d1e8bdaeba7bfca0c527f495e2d.jpg', 'R0217', '1'),
(194, 'IIN EKA LESTARI, SH., M.Kn', 'BOJONEGORO', '499219', '11-01-2022', 'IIN EKA LESTARI, SH., M.Kn- Bukti_Pembayaran - Screenshot_20220111-193006_BCA_mobile[1].jpg', 'I0219', '1'),
(195, 'EKO SUNU JATMIKO, SH, M.Kn.', 'KEDIRI', '499222', '11-01-2022', 'EKO SUNU JATMIKO, SH, M.Kn.- Bukti_Pembayaran - Screenshot_20220111-213715_WhatsApp.jpg', 'E0222', '1'),
(196, 'PRIADI DARMAPUTRA, SH., MBA., M.Kn', 'LAMONGAN', '499224', '12-01-2022', 'PRIADI DARMAPUTRA, SH., MBA., M.Kn- Bukti_Pembayaran - MBRC_1641946954986.png', 'P0224', '1'),
(197, 'MOCHAMAD DIDIT ERVADHI, S.H.', 'SURABAYA', '500000', '12-01-2022', 'MOCHAMAD DIDIT ERVADHI, S.H.- Bukti_Pembayaran - MBRC_1641949173665.png', 'M0223', '1'),
(198, 'NI MADE DIESTRIANA DWI WAHYUNI, S.H.', 'SIDOARJO', '499218', '12-01-2022', 'NI MADE DIESTRIANA DWI WAHYUNI, S.H.- Bukti_Pembayaran - 1285D66B-3010-4756-9126-C9C2426721A9.jpeg', 'N0218', '1'),
(199, 'AGIL SUWARTO, SH.M.Kn.', 'GRESIK', '499221', '12-01-2022', 'AGIL SUWARTO, SH.M.Kn.- Bukti_Pembayaran - Bukti Bayar.jpeg', 'A0221', '1'),
(200, 'BAMBANG SOESATIO WIDODO, S.H.,M.Kn.', 'SIDOARJO', '499149', '12-01-2022', 'BAMBANG SOESATIO WIDODO, S.H.,M.Kn.- Bukti_Pembayaran - CamScanner 01-12-2022 09.23.pdf', 'B0149', '1'),
(201, 'MEIRA ASTRI, SH, M.Kn.', 'KEDIRI', '499229', '12-01-2022', 'MEIRA ASTRI, SH, M.Kn.- Bukti_Pembayaran - IMG-20220112-WA0005.jpg', 'M0229', '1'),
(202, 'MUTI`ATUL KHASANAH, SH.', 'KAB. JEMBER & KAB. BONDOWOSO', '499234', '12-01-2022', 'MUTI`ATUL KHASANAH, SH.- Bukti_Pembayaran - WhatsApp Image 2022-01-12 at 10.20.21.jpeg', 'M0234', '1'),
(203, 'NURUL LATIFAH, S.H., M.Kn.', 'KOTA MOJOKERTO', '499235', '12-01-2022', 'NURUL LATIFAH, S.H., M.Kn.- Bukti_Pembayaran - WhatsApp Image 2022-01-12 at 10.27.21.jpeg', 'N0235', '1'),
(204, 'NOVI KOERFIANA, SH., M.Kn.', 'BANGKALAN', '499200', '12-01-2022', 'NOVI KOERFIANA, SH., M.Kn.- Bukti_Pembayaran - WhatsApp Image 2022-01-12 at 10.45.15.jpeg', 'N0200', '1'),
(205, 'HENI YUNIANTIN, S.H., M.Kn.', 'SIDOARJO', '499187', '12-01-2022', 'HENI YUNIANTIN, S.H., M.Kn.- Bukti_Pembayaran - BUKTI BAYAR HENI Y.jpg', 'H0187', '1'),
(206, 'JANTO KUSUMA KOE, SH.M.HUM.', 'GRESIK', '499232', '12-01-2022', 'JANTO KUSUMA KOE, SH.M.HUM.- Bukti_Pembayaran - BUKTI BAYAR KONFERWIL JATIM.jpeg', 'J0232', '1'),
(207, 'VIRIZCHA MEIRIN ROMADHONA, SH.,M.Kn', 'GRESIK', '499240', '12-01-2022', 'VIRIZCHA MEIRIN ROMADHONA, SH.,M.Kn- Bukti_Pembayaran - bukti bayar konferwil ippat.jpg', 'V0240', '1'),
(208, 'MARGARETHA DYANAWATY, SH', 'SURABAYA', '499233', '12-01-2022', 'MARGARETHA DYANAWATY, SH- Bukti_Pembayaran - BUKTI BAYAR PENDAFTARAN KONFERENSI WILAYAH JAWA TIMUR.jpeg', 'M0233', '1'),
(209, 'KUSUMANING TRIASTINA, SH.M.KN', 'KAB MADIUN', '499241', '12-01-2022', 'KUSUMANING TRIASTINA, SH.M.KN- Bukti_Pembayaran - Bukti Transfer Konferwil.jpeg', 'K0241', '1'),
(210, 'VERONICA SRI RAHAYUNINGTYAS, S.H., M.Kn.', 'TRENGGALEK', '499207', '12-01-2022', 'VERONICA SRI RAHAYUNINGTYAS, S.H., M.Kn.- Bukti_Pembayaran - IMG20220112124344.jpg', 'V0207', '1'),
(211, 'IDA ARWIKE FRANS, S.H, M.Kn.', 'SIDOARJO', '499215', '12-01-2022', 'IDA ARWIKE FRANS, S.H, M.Kn.- Bukti_Pembayaran - WhatsApp Image 2022-01-12 at 12.51.02.jpeg', 'I0215', '1'),
(212, 'SUYATNO, S.H., M.H.', 'SIDOARJO', '499228', '12-01-2022', 'SUYATNO, S.H., M.H.- Bukti_Pembayaran - IMG20220112130941.jpg', 'S0228', '1'),
(213, 'MUSDHALIFAH TUS SOLIKHA, S.H., M.KN', 'GRESIK', '499246', '12-01-2022', 'MUSDHALIFAH TUS SOLIKHA, S.H., M.KN- Bukti_Pembayaran - FT122932865.png', 'M0246', '1'),
(214, 'SILVIA PERMATA SARI, S.H., M.Kn.', 'TRENGGALEK', '499226', '12-01-2022', 'SILVIA PERMATA SARI, S.H., M.Kn.- Bukti_Pembayaran - Screen Shot 2022-01-12 at 13.57.53.png', 'S0226', '1'),
(215, 'SADIQ GINTING, S.H., M.Kn.', 'TRENGGALEK', '499216', '12/01/2022', 'SADIQ GINTING, S.H., M.Kn.- Bukti_Pembayaran - Bukti Bayar SADIQ GINTING.jpg', 'S0216', '1'),
(216, 'ISMAILIA KURNIAWATI, S.H., M.Kn.', 'SUMENEP', '499244', '12-01-2022', 'ISMAILIA KURNIAWATI, S.H., M.Kn.- Bukti_Pembayaran - IMG_20220112_143216.jpg', 'I0244', '1'),
(217, 'RR. ULAN UNDARI, S.H.', 'SURABAYA', '499172', '12-01-2022', 'RR. ULAN UNDARI, S.H.- Bukti_Pembayaran - IMG-20220112-WA0008.jpg', 'R0172', '1'),
(218, 'MUHAMMAD YUSUF IBRAHIM, SH, M.Kn', 'SITUBONDO', '499239', '12-01-2022', 'MUHAMMAD YUSUF IBRAHIM, SH, M.Kn- Bukti_Pembayaran - img002.jpg', 'M0239', '1'),
(219, 'NILAM MAHARANI, S.H., M.Kn', 'GRESIK', '499251', '12-01-2022', 'NILAM MAHARANI, S.H., M.Kn- Bukti_Pembayaran - 1853018D-72D8-4F9D-A684-96A8AA4238DD.jpeg', 'N0251', '1'),
(220, 'AMRIDA THALIB, SH.M.Kn.', 'GRESIK', '499250', '12-01-2022', 'AMRIDA THALIB, SH.M.Kn.- Bukti_Pembayaran - 9A328F58-337B-41CF-B68B-917BF36D70F0.jpeg', 'A0250', '1'),
(221, 'ACHMAD MUIN, S.H., S.E., M.Kn', 'GRESIK', '499252', '12-01-2022', 'ACHMAD MUIN, S.H., S.E., M.Kn- Bukti_Pembayaran - WhatsApp Image 2022-01-12 at 16.06.44.jpeg', 'A0252', '1'),
(222, 'ISSAK LAURENS, S.H., M.Kn.', 'SURABAYA', '499148', '07-01-2022', 'ISSAK LAURENS, S.H., M.Kn.- Bukti_Pembayaran - 054E2B2F-C761-4426-B18F-05E19D15338A.jpeg', 'I0148', '1'),
(223, 'WIDYA DEWI KRISDIANA, SH., M.Kn.', 'PASURUAN', '499170', '13-01-2022', 'WIDYA DEWI KRISDIANA, SH., M.Kn.- Bukti_Pembayaran - bukti transfer seminar.jpg', 'W0170', '1'),
(224, 'ANTON AL HARUN, SH., M.Kn', 'TUBAN', '499237', '12-01-2022', 'ANTON AL HARUN, SH., M.Kn- Bukti_Pembayaran - IMG20220112181002.jpg', 'A0237', '1'),
(225, 'FAJAR CAHYANTO SANTOSA, SH.,M.Kn.', 'KEDIRI', '499253', '12-01-2022', 'FAJAR CAHYANTO SANTOSA, SH.,M.Kn.- Bukti_Pembayaran - IMG-20220112-WA0011.jpg', 'F0253', '1'),
(226, 'MEGA ARFIAH, S.H., M.KN.', 'SIDOARJO', '499255', '12-01-2022', 'MEGA ARFIAH, S.H., M.KN.- Bukti_Pembayaran - 74B09625-C452-41B9-A2C5-6822218AF5A2.png', 'M0255', '1'),
(227, 'RINI PUJI ASTUTI, S.H., M.Kn', 'PACITAN', '499225', '12-01-2022', 'RINI PUJI ASTUTI, S.H., M.Kn- Bukti_Pembayaran - CamScanner 01-12-2022 11.34.pdf', 'R0225', '1'),
(228, 'REXI SURA MAHARDIKA, S.H., M.Kn.', 'SURABAYA', '499002', '30-12-2021', 'REXI SURA MAHARDIKA, S.H., M.Kn.- Bukti_Pembayaran - WhatsApp Image 2021-12-30 at 12.03.12.jpeg', 'R0002', '1'),
(229, 'VIVI VIGATI, SH., M.Kn.', 'PASURUAN', '499231', '12-01-2022', 'VIVI VIGATI, SH., M.Kn.- Bukti_Pembayaran - 1678979C-892A-472D-ACE0-586A1E28C240.jpeg', 'V0231', '1'),
(230, 'MICHAEL SALIM, S.H., M.Kn.', 'PASURUAN', '499236', '12-01-2022', 'MICHAEL SALIM, S.H., M.Kn.- Bukti_Pembayaran - EE45F5DB-7196-4F9B-A5A7-231E8193F725.png', 'M0236', '1'),
(231, 'ARINI JAUHAROH, SH, M.Kn', 'KABUPATEN MALANG', '499220', '13-01-2022', 'ARINI JAUHAROH, SH, M.Kn- Bukti_Pembayaran - WhatsApp Image 2022-01-13 at 05.40.45.jpeg', 'A0220', '1'),
(232, 'HALIMATUS SOPHIAH, S.H.', 'TUBAN', '499247', '12-01-2022', 'HALIMATUS SOPHIAH, S.H.- Bukti_Pembayaran - WhatsApp Image 2022-01-12 at 21.23.20.jpeg', 'H0247', '1'),
(233, 'R. ISKANDAR, S.H., M.Kn.', 'SUMENEP', '499102', '13-01-2022', 'R. ISKANDAR, S.H., M.Kn.- Bukti_Pembayaran - WhatsApp Image 2022-01-13 at 09.49.29.jpeg', 'R0102', '1'),
(234, 'WIDYAWATI, S.PI, SH,M.KN', 'KAB MADIUN', '499260', '13-01-2022', 'WIDYAWATI, S.PI, SH,M.KN- Bukti_Pembayaran - WhatsApp Image 2022-01-13 at 9.53.08 AM.jpeg', 'W0260', '1'),
(235, 'SISMA MADU MITAKOL KAINI, S.H., M.KN', 'MAGETAN', '499262', '13-01-2022', 'SISMA MADU MITAKOL KAINI, S.H., M.KN- Bukti_Pembayaran - BUKTI BAYAR.jpeg', 'S0262', '1'),
(236, 'ENDRO SATRIO, S.H., M.KN.', 'KOTA BLITAR', '499263', '13-01-2022', 'ENDRO SATRIO, S.H., M.KN.- Bukti_Pembayaran - 001.jpg', 'E0263', '1'),
(237, 'DYAH AYU RAFIKASARI, SH., M.KN.', 'BLITAR', '499267', '13-01-2022', 'DYAH AYU RAFIKASARI, SH., M.KN.- Bukti_Pembayaran - Screenshot_20220113-105034_BNIMobilenew.jpg', 'D0267', '1'),
(238, 'DYAH WIDHIAWATI, S.H., M.KN.', 'KOTA MALANG', '499266', '13-01-2022', 'DYAH WIDHIAWATI, S.H., M.KN.- Bukti_Pembayaran - transfer 12-01-2022.jpeg', 'D0266', '1'),
(239, 'ACHYANI YULIARTI, S.H.', 'SIDOARJO', '499268', '13-01-2022', 'ACHYANI YULIARTI, S.H.- Bukti_Pembayaran - MBRC_1642046405167.png', 'A0268', '1'),
(240, 'HJ. DYANA WULAN SARI, SH., M.Kn', 'LAMONGAN', '499111', '13-01-2022', 'HJ. DYANA WULAN SARI, SH., M.Kn- Bukti_Pembayaran - WhatsApp Image 2022-01-13 at 09.18.21.jpeg', 'H0111', '1'),
(241, 'ATIK PRIHARTATIK, SH. M.Kn', 'KAB MADIUN', '499259', '13-01-2022', 'ATIK PRIHARTATIK, SH. M.Kn- Bukti_Pembayaran - BUKTI BAYAR.pdf', 'A0259', '1'),
(242, 'LIANA MARIA FATIKHATUN, SH., M.KN', 'KABUPATEN MALANG', '499273', '13-01-2022', 'LIANA MARIA FATIKHATUN, SH., M.KN- Bukti_Pembayaran - BUKTI PEMBAYARAN.jpeg', 'L0273', '1'),
(243, 'WAHYUNI PANGESTUTI, SH, M.Kn', 'KABUPATEN MALANG', '499258', '13-01-2022', 'WAHYUNI PANGESTUTI, SH, M.Kn- Bukti_Pembayaran - WhatsApp Image 2022-01-13 at 11.48.49.jpeg', 'W0258', '1'),
(244, 'TINUK SETIYAWATI, S.H', 'PAMEKASAN', '499269', '13/01/2022', 'TINUK SETIYAWATI, S.H- Bukti_Pembayaran - BUKTI BAYAR KONFERWIL JAN 2022.pdf', 'T0269', '1'),
(245, 'BAGUS DWI RIANTO,S.H.,M.KN', 'NGANJUK', '499276', '13-01-2022', 'BAGUS DWI RIANTO,S.H.,M.KN- Bukti_Pembayaran - WhatsApp Image 2022-01-13 at 12.46.06.jpeg', 'B0276', '1'),
(246, 'LENNY WIBOWO, SH., M.Kn.', 'KOTA BATU', '499230', '13-01-2022', 'LENNY WIBOWO, SH., M.Kn.- Bukti_Pembayaran - WhatsApp Image 2022-01-13 at 10.26.45.jpeg', 'L0230', '1'),
(247, 'SUGIMAN, S.H., M.KN.', 'MOJOKERTO', '499279', '13-01-2022', 'SUGIMAN, S.H., M.KN.- Bukti_Pembayaran - WhatsApp Image 2022-01-13 at 13.24.55.jpeg', 'S0279', '1'),
(248, 'SESILIA AGUSTINA, S.H., M.KN.', 'TRENGGALEK', '499280', '13-01-2022', 'SESILIA AGUSTINA, S.H., M.KN.- Bukti_Pembayaran - F2BC0413-E78E-4D7B-927B-9783F04F546F.png', 'S0280', '1'),
(249, 'CAROLIN CONSTANTINA KALAMPUNG, S.H.', 'SURABAYA', '499271', '13-01-2022', 'CAROLIN CONSTANTINA KALAMPUNG, S.H.- Bukti_Pembayaran - BUKTI SETOR.jpeg', 'C0271', '1'),
(250, 'TUTI RAHAJU ,S.H., M.KN.', 'SURABAYA', '499281', '13-01-2022', 'TUTI RAHAJU ,S.H., M.KN.- Bukti_Pembayaran - BUKTI BAYAR.pdf', 'T0281', '1'),
(251, 'HARIJANI, S.H., M.KN.', 'KOTA BLITAR', '499284', '13-01-2022', 'HARIJANI, S.H., M.KN.- Bukti_Pembayaran - IMG-20220113-WA0017.jpg', 'H0284', '1'),
(252, 'DANIEK YHUNITA, S.H., M.Kn', 'TUBAN', '499275', '13-01-2022', 'DANIEK YHUNITA, S.H., M.Kn- Bukti_Pembayaran - BUKTI BAYAR.pdf', 'D0275', '1'),
(253, 'YULIARDI UMI AYUNING P. SH., M.KN.', 'BANGKALAN', '499287', '13-01-2022', 'YULIARDI UMI AYUNING P. SH., M.KN.- Bukti_Pembayaran - Screenshot_20220113-145132_WhatsApp.jpg', 'Y0287', '1'),
(254, 'EMY MURIANI, S.H., M.Kn.', 'TRENGGALEK', '499254', '13-01-2022', 'EMY MURIANI, S.H., M.Kn.- Bukti_Pembayaran - 1642060833474156063643860425602.jpg', 'E0254', '1'),
(255, 'SUWELO HARDJITO,S.H.,M.Kn.', 'NGANJUK', '499274', '13-01-2022', 'SUWELO HARDJITO,S.H.,M.Kn.- Bukti_Pembayaran - 1642063014026123527172753516070.jpg', 'S0274', '1'),
(256, 'ANNA MARIA, S.H.', 'SURABAYA', '499292', '13-01-2022', 'ANNA MARIA, S.H.- Bukti_Pembayaran - ANNA, SLIP KONFERWIL 2022.png', 'A0292', '1'),
(257, 'MUHANDAS AGIT PRASETYA, S.H., M.Kn', 'KAB. JEMBER & KAB. BONDOWOSO', '499290', '13-01-2022', 'MUHANDAS AGIT PRASETYA, S.H., M.Kn- Bukti_Pembayaran - Bukti Bayar Konferwil.jpeg', 'M0290', '1'),
(258, 'MEINDAR FAJAR MARHIYANTO, S.H., M.Kn.', 'TRENGGALEK', '499291', '13-01-2022', 'MEINDAR FAJAR MARHIYANTO, S.H., M.Kn.- Bukti_Pembayaran - Screenshot_2022-01-13-16-06-37-627_id.dana.jpg', 'M0291', '1'),
(259, 'ABDUL HAMID, SH., M.Kn.', 'PASURUAN', '499282', '13-01-2022', 'ABDUL HAMID, SH., M.Kn.- Bukti_Pembayaran - Screenshot_2022-01-13-16-23-19-39_e8205ec1cda7e9657fadf502be9b7b78.jpg', 'A0282', '1'),
(260, 'GAGARINA DWI WAHYUNINGTYAS, S.H.', 'KAB KEDIRI', '499265', '13-01-2022', 'GAGARINA DWI WAHYUNINGTYAS, S.H.- Bukti_Pembayaran - BUKTI BAYAR IPPAT 2022.pdf', 'G0265', '1'),
(261, 'YULI ERIKA SIPAYUNG, SH., M.Kn', 'TUBAN', '499270', '13-01-2022', 'YULI ERIKA SIPAYUNG, SH., M.Kn- Bukti_Pembayaran - 20220113_170843.jpg', 'Y0270', '1'),
(262, 'INDRA MEDITYA MARDIYANTO, S.H., M.Kn.', 'TRENGGALEK', '499277', '13-01-2022', 'INDRA MEDITYA MARDIYANTO, S.H., M.Kn.- Bukti_Pembayaran - IMG-20220113-WA0001.jpg', 'I0277', '1'),
(263, 'DR. HABIB ADJIE,S.H., M.HUM.', 'SURABAYA', '499227', '13-01-2022', 'DR. HABIB ADJIE,S.H., M.HUM.- Bukti_Pembayaran - IMG-20220113-WA0234.jpg', 'D0227', '1'),
(264, 'DR. FIRMANSJAH, S.H., M.HUM', 'PAMEKASAN', '499283', '13-01-2022', 'DR. FIRMANSJAH, S.H., M.HUM- Bukti_Pembayaran - WhatsApp Image 2022-01-13 at 22.08.09.jpeg', 'D0283', '1'),
(265, 'ENDANG SULISTYO KARTIKAWATI, S.H.', 'PROBOLINGGO', '499289', '14-01-2022', 'ENDANG SULISTYO KARTIKAWATI, S.H.- Bukti_Pembayaran - IMG-20220114-WA0004.jpg', 'E0289', '1'),
(266, 'EKA APRIYUDI,S.H.,M.Kn', 'PONOROGO', '499288', '14-01-2022', 'EKA APRIYUDI,S.H.,M.Kn- Bukti_Pembayaran - Bukti bayar.pdf', 'E0288', '1'),
(267, 'EDWARD PANGARA SIRAIT, S.H., M.Kn.', 'MOJOKERTO', '499245', '14-01-2022', 'EDWARD PANGARA SIRAIT, S.H., M.Kn.- Bukti_Pembayaran - BUKTI PEMBAYARAN KONFERWIL.jpeg', 'E0245', '1'),
(268, 'SETYA BUDHI, S.H', 'PONOROGO', '499264', '14-01-2022', 'SETYA BUDHI, S.H- Bukti_Pembayaran - bukti bayar pendaftaran.jpg', 'S0264', '1'),
(269, 'ARINTA SETYAWARDANI, S.H., M.KN.', 'SIDOARJO', '499295', '14-01-2022', 'ARINTA SETYAWARDANI, S.H., M.KN.- Bukti_Pembayaran - WhatsApp Image 2022-01-14 at 10.16.39.jpeg', 'A0295', '1'),
(270, 'WIDATUL MILLAH, SH.', 'GRESIK', '499297', '14-01-2022', 'WIDATUL MILLAH, SH.- Bukti_Pembayaran - WhatsApp Image 2022-01-14 at 10.31.35.jpeg', 'W0297', '1'),
(271, 'SAADIAH SURYANDARI, SH., M.Kn', 'PACITAN', '499278', '14-01-2022', 'SAADIAH SURYANDARI, SH., M.Kn- Bukti_Pembayaran - WhatsApp Image 2022-01-14 at 10.36.54.jpeg', 'S0278', '1'),
(272, 'PUJI RAHAYU, SE., SH., M.KN.', 'BLITAR', '499294', '14-01-2022', 'PUJI RAHAYU, SE., SH., M.KN.- Bukti_Pembayaran - bukti bayar ippat.jpeg', 'P0294', '1'),
(273, 'ANIK FARIDA AGUSTINI,SH.,M.Kn.,MH.', 'BOJONEGORO', '499248', '13-01-2022', 'ANIK FARIDA AGUSTINI,SH.,M.Kn.,MH.- Bukti_Pembayaran - WhatsApp Image 2022-01-14 at 11.06.37.jpeg', 'A0248', '1'),
(274, 'R. DHARMA INDRA WIJAYA, S.H., M.Kn.', 'BANYUWANGI', '499298', '14-01-2022', 'R. DHARMA INDRA WIJAYA, S.H., M.Kn.- Bukti_Pembayaran - Screenshot_20220114-111158_BNIMobilenew.jpg', 'R0298', '1'),
(275, 'AHMAD BADAWI, SH.M, KN', 'KAB. JEMBER & KAB. BONDOWOSO', '499194', '14-01-2022', 'AHMAD BADAWI, SH.M, KN- Bukti_Pembayaran - Screenshot_2022-01-14-11-17-58-483_com.bca.jpg', 'A0194', '1'),
(276, 'RIBKA AVIE ALRETA, S.H., M.Kn.', 'SIDOARJO', '499304', '14-01-2022', 'RIBKA AVIE ALRETA, S.H., M.Kn.- Bukti_Pembayaran - 16FC5C17-092C-41C2-BEF8-6A17ECF62C31.png', 'R0304', '1'),
(277, 'MIRA INDAH LISTYANI, S.H, M.Kn.', 'PROBOLINGGO', '499299', '14-01-2022', 'MIRA INDAH LISTYANI, S.H, M.Kn.- Bukti_Pembayaran - IMG-20220114-WA0001.jpg', 'M0299', '1'),
(278, 'MARIA AYU LIANAWATI, S.SOS, S.H, M.KN', 'GRESIK', '499305', '14-01-2022', 'MARIA AYU LIANAWATI, S.SOS, S.H, M.KN- Bukti_Pembayaran - MBRC_1642138622479.png', 'M0305', '1'),
(279, 'SONYA NATALIA, SH', 'SURABAYA', '499242', '13-01-2022', 'SONYA NATALIA, SH- Bukti_Pembayaran - IMG-20220114-WA0100.jpg', 'S0242', '1'),
(280, 'DIDIEK WAHJU INDARTA, SH', 'BOJONEGORO', '499307', '14-01-2022', 'DIDIEK WAHJU INDARTA, SH- Bukti_Pembayaran - bukti bayar.jpg', 'D0307', '1'),
(281, 'MERIE CORTINA, S.H., M.Kn.', 'BANGKALAN', '499302', '14-01-2022', 'MERIE CORTINA, S.H., M.Kn.- Bukti_Pembayaran - MutasiBCA_140122-140122.pdf', 'M0302', '1'),
(282, 'FENNY SOEBAGIO, SH.M.Kn.', 'GRESIK', '499303', '14-01-2022', 'FENNY SOEBAGIO, SH.M.Kn.- Bukti_Pembayaran - WhatsApp Image 2022-01-14 at 13.56.12.jpeg', 'F0303', '1'),
(283, 'DWI PURNAWAN YUNIARTO, S.H., M.KN.', 'BLITAR', '499313', '14-01-2022', 'bukti pembayaran313.jpeg', 'D0313', '1'),
(284, 'DINI SURYANINGSIH, SH.', 'GRESIK', '499312', '14-01-2022', 'DINI SURYANINGSIH, SH.- Bukti_Pembayaran - IMG-20220114-WA0025.jpg', 'D0312', '1'),
(285, 'YAYUK SRI UTAMI, S.H., M.SI., M.Kn.', 'SIDOARJO', '499306', '14-01-2022', 'YAYUK SRI UTAMI, S.H., M.SI., M.Kn.- Bukti_Pembayaran - Bukti Bayar Konferwil.JPG', 'Y0306', '1'),
(286, 'ZULHAM EFENDI, SH., MK.N.', 'BANYUWANGI', '499256', '14-01-2022', 'ZULHAM EFENDI, SH., MK.N.- Bukti_Pembayaran - IMG-20220114-WA0010.jpg', 'Z0256', '1'),
(287, 'KRISTININGSIH, SH.', 'PASURUAN', '499311', '14-01-2022', 'KRISTININGSIH, SH.- Bukti_Pembayaran - IMG-20220114-WA0000.jpg', 'K0311', '1'),
(288, 'ANDHINI FAJAR PRISTANTI S.H, M.Kn', 'GRESIK', '499316', '14-01-2022', 'ANDHINI FAJAR PRISTANTI S.H, M.Kn- Bukti_Pembayaran - WhatsApp Image 2022-01-14 at 15.18.43.jpeg', 'A0316', '1'),
(289, 'SELVIA ZUROIDA, S.H., M.Kn.', 'GRESIK', '499309', '14-01-2022', 'SELVIA ZUROIDA, S.H., M.Kn.- Bukti_Pembayaran - Screenshot_2022-01-14-15-47-57-59.jpg', 'S0309', '1'),
(290, 'MOHAMAD IBRAHIM, S.H.', 'KOTA MALANG', '499308', '14-01-2022', 'MOHAMAD IBRAHIM, S.H.- Bukti_Pembayaran - Bukti Bayar Transfer Pendaftaran Konferwil IPPAT.pdf', 'M0308', '1'),
(291, 'PHILIPUS KURNIA WIJAYA, SH., M.Kn.', 'PASURUAN', '499293', '14-01-2022', 'PHILIPUS KURNIA WIJAYA, SH., M.Kn.- Bukti_Pembayaran - Screenshot_20220114-163716_BNIMobilenew.jpg', 'P0293', '1');
INSERT INTO `bukti_pembayaran` (`id`, `nama_lengkap`, `pengda`, `biaya`, `tgl_bayar`, `bukti_pembayaran`, `id_pendaftaran`, `status`) VALUES
(292, 'YUDHANA EKO PRASETYO, SH., M.KN.', 'BLITAR', '499319', '14-01-2022', 'YUDHANA EKO PRASETYO, SH., M.KN.- Bukti_Pembayaran - WhatsApp Image 2022-01-14 at 16.40.18.jpeg', 'Y0319', '1'),
(293, 'M SYAIFUL ANSHARI, S.H., M.KN', 'PAMEKASAN', '499320', '14-01-2022', 'M SYAIFUL ANSHARI, S.H., M.KN- Bukti_Pembayaran - Screenshot_20220114-164453_BNIMobilenew.jpg', 'M0320', '1'),
(294, 'SITARESMI PUSPADEWI SUBIANTO S.H., M.Kn', 'SURABAYA', '499301', '14-01-2022', 'SITARESMI PUSPADEWI SUBIANTO S.H., M.Kn- Bukti_Pembayaran - Bukti bayar Sitaresmi.jpg', 'S0301', '1'),
(295, 'RIZKI ZARKASYI, S.H., M.Kn', 'GRESIK', '499285', '14-01-2022', 'RIZKI ZARKASYI, S.H., M.Kn- Bukti_Pembayaran - WhatsApp Image 2022-01-14 at 10.19.26.jpeg', 'R0285', '1'),
(296, 'TRIAS ANDRINA, S.H., M.Kn.', 'PROBOLINGGO', '499238', '14-01-2022', 'TRIAS ANDRINA, S.H., M.Kn.- Bukti_Pembayaran - WhatsApp Image 2022-01-14 at 11.58.26.jpeg', 'T0238', '1'),
(297, 'UMI SOFIA, S.H., M.Kn.', 'MOJOKERTO', '499191', '14-01-2022', 'UMI SOFIA, S.H., M.Kn.- Bukti_Pembayaran - WhatsApp Image 2022-01-14 at 11.37.02.jpeg', 'U0191', '1'),
(298, 'DEVI SOVIAN, S.H.,M.Kn', 'PONOROGO', '499272', '13-01-2022', 'DEVI SOVIAN, S.H.,M.Kn- Bukti_Pembayaran - WhatsApp Image 2022-01-14 at 17.54.44.jpeg', 'D0272', '1'),
(299, 'H. SARTONO, SH', 'SIDOARJO', '499198', '14-01-2022', 'H. SARTONO, SH- Bukti_Pembayaran - 20220112233712.pdf', 'H0198', '1'),
(300, 'SITI KUMA`IYAH, SH.', 'GRESIK', '499323', '14-01-2022', 'SITI KUMA`IYAH, SH.- Bukti_Pembayaran - Screenshot_20220114-213005.png', 'S0323', '1'),
(301, 'IRVANSYAH, S.H., M.KN', 'GRESIK', '499325', '15-01-2022', 'IRVANSYAH, S.H., M.KN- Bukti_Pembayaran - Screenshot_20220115-082805_BCA mobile.jpg', 'I0325', '1'),
(302, 'ATIKA BATOHIR, SH, M.KN', 'KABUPATEN MALANG', '499327', '15-01-2022', 'ATIKA BATOHIR, SH, M.KN- Bukti_Pembayaran - Screenshot_20220115-092833_BCA mobile.jpg', 'A0327', '1'),
(303, 'LILIK HARI SUDARYONO, S.H.,M.H.,M.KN.', 'KAB KEDIRI', '499328', '15-01-2022', 'LILIK HARI SUDARYONO, S.H.,M.H.,M.KN.- Bukti_Pembayaran - BUKTI BAYAR KONFERWIL.jpeg', 'L0328', '1'),
(304, 'IVONNE SYLVIONA,S.H.,M.Kn', 'LUMAJANG', '499310', '14-01-2022', 'IVONNE SYLVIONA,S.H.,M.Kn- Bukti_Pembayaran - WhatsApp Image 2022-01-15 at 10.25.29.jpeg', 'I0310', '1'),
(305, 'DR. SJAIFURRACHMAN, SH.,MH', 'SUMENEP', '499314', '15-01-2022', 'DR. SJAIFURRACHMAN, SH.,MH- Bukti_Pembayaran - Bukti Bayar Sjaifurrachman.jpeg', 'D0314', '1'),
(306, 'MAF`ULATUS SYARIFAH, S.H., M.Kn.', 'TRENGGALEK', '499300', '15-01-2022', 'MAF`ULATUS SYARIFAH, S.H., M.Kn.- Bukti_Pembayaran - WhatsApp Image 2022-01-15 at 10.09.34.jpeg', 'M0300', '1'),
(307, 'BENNY DWI PERMANA, SH., M.KN.', 'BLITAR', '499332', '15-01-2022', 'BENNY DWI PERMANA, SH., M.KN.- Bukti_Pembayaran - WhatsApp Image 2022-01-15 at 11.45.08.jpeg', 'B0332', '1'),
(308, 'DEWI ANGGRAINI, SH., M.KN', 'KAB. JEMBER & KAB. BONDOWOSO', '499335', '15-01-2022', 'DEWI ANGGRAINI, SH., M.KN- Bukti_Pembayaran - bukti pembayaran.pdf', 'D0335', '1'),
(309, 'ERNY SETIAWAN, S.H., M.HUM., M.KN.', 'KAB KEDIRI', '499333', '15-01-2022', 'ERNY SETIAWAN, S.H., M.HUM., M.KN.- Bukti_Pembayaran - IMG-20220115-WA0030.jpg', 'E0333', '1'),
(310, 'ANGGRAENI SARI MEGAWATI, S.H.', 'SURABAYA', '499334', '15-01-2022', 'ANGGRAENI SARI MEGAWATI, S.H.- Bukti_Pembayaran - Screenshot_20220115-123139_BCA mobile.jpg', 'A0334', '1'),
(311, 'ABDUL KHOLIQ, SH., M.Kn', 'BOJONEGORO', '499330', '15-01-2022', 'ABDUL KHOLIQ, SH., M.Kn- Bukti_Pembayaran - SLIP KONFERWIL JATIM IPPAT AKI.pdf', 'A0330', '1'),
(312, 'DEA VITA ROSANTI, SH., M.Kn.', 'PASURUAN', '499249', '15-01-2022', 'DEA VITA ROSANTI, SH., M.Kn.- Bukti_Pembayaran - WhatsApp Image 2022-01-15 at 10.09.34.jpeg', 'D0249', '1'),
(313, 'MISBAH IMAM SUBARI, SH., M.HUM', 'BANYUWANGI', '499315', '15-01-2022', 'MISBAH IMAM SUBARI, SH., M.HUM- Bukti_Pembayaran - Screenshot_20220115_153313.jpg', 'M0315', '1'),
(314, 'INDRA KASWARA MAHAR KUSUMA,SH,M.Kn', 'GRESIK', '499336', '15-01-2022', 'INDRA KASWARA MAHAR KUSUMA,SH,M.Kn- Bukti_Pembayaran - IMG-20220115-WA0042.jpg', 'I0336', '1'),
(315, 'HESTINING CHOLIFAH, SH.,M.Kn', 'BLITAR', '499326', '15-01-2022', 'HESTINING CHOLIFAH, SH.,M.Kn- Bukti_Pembayaran - bukti bayar.jpg', 'H0326', '1'),
(316, 'SRI WULANDARI, S.H., M.Kn', 'BANGKALAN', '499318', '15-01-2022', 'SRI WULANDARI, S.H., M.Kn- Bukti_Pembayaran - IMG-20220115-WA0001.jpg', 'S0318', '1'),
(317, 'KUSUMAWATI WIDURI, S.H, M.Kn', 'GRESIK', '499321', '15-01-2022', 'KUSUMAWATI WIDURI, S.H, M.Kn- Bukti_Pembayaran - WhatsApp Image 2022-01-15 at 17.37.11.jpeg', 'K0321', '1'),
(318, 'TJATUR RINDJAJANI, S.H., M.KN.', 'KAB KEDIRI', '499339', '15-01-2022', 'TJATUR RINDJAJANI, S.H., M.KN.- Bukti_Pembayaran - IMG-20220115-WA0022.jpg', 'T0339', '1'),
(319, 'NUKE SABILAWATI, SH., M.Kn', 'LAMONGAN', '499317', '15-01-2022', 'NUKE SABILAWATI, SH., M.Kn- Bukti_Pembayaran - WhatsApp Image 2022-01-15 at 20.02.06.jpeg', 'N0317', '1'),
(320, 'ESTI TIARA NINGRUM, S.H.', 'KAB KEDIRI', '499296', '15-01-2022', 'ESTI TIARA NINGRUM, S.H.- Bukti_Pembayaran - D93A97A7-2EE6-4CB1-A7FA-F77A3BC8226F.jpeg', 'E0296', '1'),
(321, 'MUTIARA VIENCENT ROSAR, S.H.,M.KN', 'SURABAYA', '499340', '16-01-2022', 'MUTIARA VIENCENT ROSAR, S.H.,M.KN- Bukti_Pembayaran - Bukti bayar Konferwil an Mutiara.jpeg', 'M0340', '1'),
(322, 'PAULA SWANDAYANI HARTANTO,SH,M.Kn', 'GRESIK', '499341', '16-01-2022', 'PAULA SWANDAYANI HARTANTO,SH,M.Kn- Bukti_Pembayaran - Bukti Transfer Konferwil An. Paula Hartanto.jpeg', 'P0341', '1'),
(323, 'AFIFAH, SH., M.KN', 'GRESIK', '499342', '16-01-2022', 'AFIFAH, SH., M.KN- Bukti_Pembayaran - MBRC_1642320336318.png', 'A0342', '1'),
(324, 'ENDAH SRIASTUTIK, S.H, S.E., M.KN', 'GRESIK', '499343', '16-01-2022', 'ENDAH SRIASTUTIK, S.H, S.E., M.KN- Bukti_Pembayaran - Bukti Bayar Pendaftaran Endah Sriastutik.jpeg', 'E0343', '1'),
(325, 'FIRDAUS AGUS DWI LESTARI, S.H., M.Kn.', 'BANYUWANGI', '499344', '16-01-2022', 'FIRDAUS AGUS DWI LESTARI, S.H., M.Kn.- Bukti_Pembayaran - Screenshot_20220116-185150_BNIMobilenew.jpg', 'F0344', '1'),
(326, 'ASRIDA SWISTI JIHAN, SH., M.Kn.', 'PASURUAN', '499329', '16-01-2022', 'ASRIDA SWISTI JIHAN, SH., M.Kn.- Bukti_Pembayaran - WhatsApp Image 2022-01-15 at 10.09.34.jpeg', 'A0329', '1'),
(327, 'YOLANDA TAURESIA SISWADI, S.H., M.Kn.', 'SIDOARJO', '499345', '16-01-2022', 'YOLANDA TAURESIA SISWADI, S.H., M.Kn.- Bukti_Pembayaran - WhatsApp Image 2022-01-15 at 10.09.34.jpeg', 'Y0345', '1'),
(328, 'IVAN HAMEDA, S.H., M.KN', 'GRESIK', '499347', '17-01-2022', 'IVAN HAMEDA, S.H., M.KN- Bukti_Pembayaran - Screenshot_20220117-082209_BNIMobilenew.jpg', 'I0347', '1'),
(329, 'AMELIA DARMASTUTY, S.H., M.Kn.', 'SIDOARJO', '499338', '17-01-2022', 'AMELIA DARMASTUTY, S.H., M.Kn.- Bukti_Pembayaran - 20220117_083323.jpg', 'A0338', '1'),
(330, 'AGNES NINIK MUTIARA WIDJAJA, S.H.', 'SURABAYA', '499348', '17-01-2022', 'AGNES NINIK MUTIARA WIDJAJA, S.H.- Bukti_Pembayaran - Image-1(1).jpg', 'A0348', '1'),
(331, 'CHRISTIANAWATI, S.H., M.KN.', 'KOTA MALANG', '499349', '17-01-2022', 'CHRISTIANAWATI, S.H., M.KN.- Bukti_Pembayaran - IMG-20220117-WA0002.jpg', 'C0349', '1'),
(332, 'CAHYO EDHI NUGROHO, SH., M.KN', 'KABUPATEN MALANG', '499351', '17-01-2022', 'CAHYO EDHI NUGROHO, SH., M.KN- Bukti_Pembayaran - WhatsApp Image 2022-01-17 at 09.02.41.jpeg', 'C0351', '1'),
(333, 'SOESILO HADI RIJANTO, SH., M.H., M.Kn', 'GRESIK', '499331', '17-01-2022', 'SOESILO HADI RIJANTO, SH., M.H., M.Kn- Bukti_Pembayaran - BUKTI PEMBAYARAN SOESILO HADI RIJANTO.jpeg', 'S0331', '1'),
(334, 'DR. HATTA ISNAINI WAHYU UYOMO, S.H., M.KN', 'GRESIK', '499356', '17-01-2022', 'DR. HATTA ISNAINI WAHYU UYOMO, S.H., M.KN- Bukti_Pembayaran - Screenshot_20220117-094523.jpg', 'D0356', '1'),
(335, 'RITA SUTANDIO, SH., M.Kn.', 'PROBOLINGGO', '499360', '17-01-2022', 'RITA SUTANDIO, SH., M.Kn.- Bukti_Pembayaran - Screenshot_20220117-100824_BCA mobile.jpg', 'R0360', '1'),
(336, 'LADY JOSEPHINE PANTOUW, S.H., M.Kn.', 'MOJOKERTO', '499361', '17-01-2022', 'LADY JOSEPHINE PANTOUW, S.H., M.Kn.- Bukti_Pembayaran - BUKTIBYAR.jpeg', 'L0361', '1'),
(337, 'RINI IDAWATI, SH., M.Kn', 'LAMONGAN', '499362', '17-01-2022', 'RINI IDAWATI, SH., M.Kn- Bukti_Pembayaran - MBRC_1642389632319.png', 'R0362', '1'),
(338, 'SULIKARMIATI, SH.M.Kn.', 'GRESIK', '499322', '16-01-2022', 'SULIKARMIATI, SH.M.Kn.- Bukti_Pembayaran - Bukti Bayar Umi Suli.jpeg', 'S0322', '1'),
(339, 'SHEPTA PRIYAMBODO, SH, M.Kn', 'KABUPATEN MALANG', '499369', '17-01-2022', 'SHEPTA PRIYAMBODO, SH, M.Kn- Bukti_Pembayaran - Bukti Bayar.jpeg', 'S0369', '1'),
(340, 'PARAMITA CAESARINA, S.H., M.Kn', 'GRESIK', '499367', '17-01-2022', 'PARAMITA CAESARINA, S.H., M.Kn- Bukti_Pembayaran - BUKTI BAYAR KONFERWIL IPPAT ATAS NAMA PARAMITA CAESARINA.jpg', 'P0367', '1'),
(341, 'NOVITASARI DIAN PHRA HARINI, SE, SH, M.KN.', 'KOTA BATU', '499368', '17-01-2022', 'NOVITASARI DIAN PHRA HARINI, SE, SH, M.KN.- Bukti_Pembayaran - Bukti Bayar Transfer .jpeg', 'N0368', '1'),
(342, 'YANI HARYANI, S.H., M.KN.', 'SIDOARJO', '499372', '17-01-2022', 'YANI HARYANI, S.H., M.KN.- Bukti_Pembayaran - 20220117_110048.jpg', 'Y0372', '1'),
(343, 'DEWI SRI RAHAYU, S.H.', 'SURABAYA', '499355', '17-01-2022', 'DEWI SRI RAHAYU, S.H.- Bukti_Pembayaran - BUKTI BAYAR KONFERWIL JATIM.pdf', 'D0355', '1'),
(344, 'HENGKI BUDI PRIYANTO. P, SH', 'SIDOARJO', '499371', '17-01-2022', 'HENGKI BUDI PRIYANTO. P, SH- Bukti_Pembayaran - PHOTO-2022-01-17-11-04-27.jpg', 'H0371', '1'),
(345, 'FERRIAAL, S.H, M.Kn.', 'KOTA MOJOKERTO', '499366', '18-01-2022', 'FERRIAAL, S.H, M.Kn.- Bukti_Pembayaran - D082852B-B56B-4050-A5F5-E5450882FA13.jpeg', 'F0366', '1'),
(346, 'FENTI AGUSTININGTYAS, S.H., M.Kn.', 'KAB KEDIRI', '499352', '17-01-2022', 'FENTI AGUSTININGTYAS, S.H., M.Kn.- Bukti_Pembayaran - bukti bayar ippat.jpeg', 'F0352', '1'),
(347, 'OCTAVIA INDRASARI ANGGARINA, SH., L.L.M., M.Kn.', 'GRESIK', '499373', '17-01-2022', 'OCTAVIA INDRASARI ANGGARINA, SH., L.L.M., M.Kn.- Bukti_Pembayaran - Bukti Bayar.jpeg', 'O0373', '1'),
(348, 'DWIANA JULIASTUTI, SH', 'PROBOLINGGO', '499354', '17-01-2022', 'DWIANA JULIASTUTI, SH- Bukti_Pembayaran - IMG-20220117-WA0008.jpg', 'D0354', '1'),
(349, 'SRI MULYONO HERMAWAN,S.H', 'NGAWI', '499261', '17-01-2022', 'SRI MULYONO HERMAWAN,S.H- Bukti_Pembayaran - downloadMandiri1642393891431.jpg', 'S0261', '1'),
(350, 'CHRISTIANI HARTONO, S.H.', 'SURABAYA', '499374', '17-01-2022', 'CHRISTIANI HARTONO, S.H.- Bukti_Pembayaran - christiani hartono .jpg', 'C0374', '1'),
(351, 'KRISNA ADI WIJAYA, S.H., M.KN.', 'PONOROGO', '499385', '17-01-2022', 'KRISNA ADI WIJAYA, S.H., M.KN.- Bukti_Pembayaran - Screenshot_2022-01-10-11-02-02-93_f339d16c976c0b263d991820e972fb72.jpg', 'K0385', '1'),
(352, 'AFRIDA CHANIFIYAH, SH., M.Kn.', 'KEDIRI', '499243', '17-01-2022', 'AFRIDA CHANIFIYAH, SH., M.Kn.- Bukti_Pembayaran - IMG-20220117-WA0018.jpg', 'A0243', '1'),
(353, 'RICA WULANDARI,S.H.,M.Kn', 'NGAWI', '499379', '17-01-2022', 'RICA WULANDARI,S.H.,M.Kn- Bukti_Pembayaran - IMG_Mon Jan 17 12_42_37 GMT+07_00 2022.jpg', 'R0379', '1'),
(354, 'DIAN PERMADHANI, S.H., M.Kn.', 'JOMBANG', '499384', '17-01-2022', 'DIAN PERMADHANI, S.H., M.Kn.- Bukti_Pembayaran - BUKTI BAYAR KONFERWIL.jpg', 'D0384', '1'),
(355, 'FARAH FATATY S.H, M.Kn', 'GRESIK', '499365', '17-01-2022', 'FARAH FATATY S.H, M.Kn- Bukti_Pembayaran - bukti bayar konferwil ippat 2022.jpg', 'F0365', '1'),
(356, 'BADRUS SALEH, SH.', 'GRESIK', '499375', '17-01-2022', 'BADRUS SALEH, SH.- Bukti_Pembayaran - Bukti Bayar Konferwil IPPAT 2022 Badrus Saleh.jpeg', 'B0375', '1'),
(357, 'PURWATIE HANIEFAH, S.H., M.Kn', 'MAGETAN', '499390', '17-01-2022', 'PURWATIE HANIEFAH, S.H., M.Kn- Bukti_Pembayaran - MBRC_1642399822810.png', 'P0390', '1'),
(358, 'IKA ISMANIJARTI, S.H.', 'SIDOARJO', '499364', '17-01-2022', 'IKA ISMANIJARTI, S.H.- Bukti_Pembayaran - BUKTI BAYAR.jpg', 'I0364', '1'),
(359, 'YUNIARSO BUDIPRIJANTO, S.H.', 'SIDOARJO', '499337', '17-01-2022', 'YUNIARSO BUDIPRIJANTO, S.H.- Bukti_Pembayaran - WhatsApp Image 2022-01-17 at 13.19.46.jpeg', 'Y0337', '1'),
(360, 'ARIANA YANUATRIZANTI, S.H.', 'SIDOARJO', '499378', '17-01-2022', 'ARIANA YANUATRIZANTI, S.H.- Bukti_Pembayaran - IMG-20220117-WA0038.jpg', 'A0378', '1'),
(361, 'NOERINDAH PRISTIANA, S.H., M.Kn', 'GRESIK', '499357', '17-01-2022', 'NOERINDAH PRISTIANA, S.H., M.Kn- Bukti_Pembayaran - IMG_20220117_133814.jpg', 'N0357', '1'),
(362, 'RHOZY WIRIANTO, SH., M.Kn', 'PROBOLINGGO', '499387', '17-01-2022', 'RHOZY WIRIANTO, SH., M.Kn- Bukti_Pembayaran - BUKTI BAYAR AN. RHOZY WIRIANTO.jpeg', 'R0387', '1'),
(363, 'SITI NURUL HIDAJAH, SH., M.Kn', 'BOJONEGORO', '499358', '17-01-2022', 'SITI NURUL HIDAJAH, SH., M.Kn- Bukti_Pembayaran - 1 001.jpg', 'S0358', '1'),
(364, 'FEBRI DWI HARTANTI, SH., M.Kn.', 'PASURUAN', '499395', '17-01-2022', 'FEBRI DWI HARTANTI, SH., M.Kn.- Bukti_Pembayaran - WhatsApp Image 2022-01-17 at 14.06.56.jpeg', 'F0395', '1'),
(365, 'ROMA PANJAITAN SH', 'SURABAYA', '499353', '17-01-2022', 'ROMA PANJAITAN SH- Bukti_Pembayaran - image.jpg', 'R0353', '1'),
(366, 'MUHAMMAD NAJIB, S.H., M.Kn.', 'PROBOLINGGO', '499383', '17-01-2022', 'MUHAMMAD NAJIB, S.H., M.Kn.- Bukti_Pembayaran - WhatsApp Image 2022-01-17 at 13.13.41.jpeg', 'M0383', '1'),
(367, 'FENNIZAR WULANDARI SIWI, S.H., M.Kn.', 'SIDOARJO', '499394', '17-01-2022', 'FENNIZAR WULANDARI SIWI, S.H., M.Kn.- Bukti_Pembayaran - Screenshot_2022-01-17-14-44-00-27_e8205ec1cda7e9657fadf502be9b7b78.jpg', 'F0394', '1'),
(368, 'TOMI ADITYARAHMAN, S.H., M.Kn', 'GRESIK', '499399', '17-01-2022', 'TOMI ADITYARAHMAN, S.H., M.Kn- Bukti_Pembayaran - Bukti Bayar.jpeg', 'T0399', '1'),
(369, 'NURIL LAILATUSSIFA, S.H., M.Kn.', 'MOJOKERTO', '499398', '17-01-2022', 'NURIL LAILATUSSIFA, S.H., M.Kn.- Bukti_Pembayaran - BUKTI BAYAR NOTARIS NURIL MOJOKERTO.jpeg', 'N0398', '1'),
(370, 'ALAN STEVEN, SH., M.KN.', 'BLITAR', '499401', '17-01-2022', 'ALAN STEVEN, SH., M.KN.- Bukti_Pembayaran - Bukti Bayar Konferwil IPPAT.jpeg', 'A0401', '1'),
(371, 'SONY ACHMAD ZUNAEDY, S.H., M.KN', 'GRESIK', '499402', '17-01-2022', 'SONY ACHMAD ZUNAEDY, S.H., M.KN- Bukti_Pembayaran - BUKTI BAYAR KONFERWIL SONY.jpeg', 'S0402', '1'),
(372, 'YANO MAHENDRA TOMI ATMAJA, S.H.,M.KN.', 'BANYUWANGI', '499404', '17-01-2022', 'YANO MAHENDRA TOMI ATMAJA, S.H.,M.KN.- Bukti_Pembayaran - B986F5D8-9353-4606-AC44-9FFD8A796810.png', 'Y0404', '1'),
(373, 'SONY BELLA PRAKAWAN, S.H., M.Kn.', 'PONOROGO', '499405', '17-01-2022', 'SONY BELLA PRAKAWAN, S.H., M.Kn.- Bukti_Pembayaran - MBRC_1642408663449.png', 'S0405', '1'),
(374, 'MARWIYAH., S.H., M.Kn.', 'BANYUWANGI', '499397', '17-01-2022', 'MARWIYAH., S.H., M.Kn.- Bukti_Pembayaran - BUKTI BAYAR BU WIWIK.jpeg', 'M0397', '1'),
(375, 'WIJOSENO, S.H., M.Kn.', 'BANYUWANGI', '499396', '17-01-2022', 'WIJOSENO, S.H., M.Kn.- Bukti_Pembayaran - IMG20220117152259.jpg', 'W0396', '1'),
(376, 'NAFIATURROHMAH,S.H.,M.KN', 'NGAWI', '499407', '17-01-2022', 'NAFIATURROHMAH,S.H.,M.KN- Bukti_Pembayaran - WhatsApp Image 2022-01-17 at 15.54.12.jpeg', 'N0407', '1'),
(377, 'EGA DIVA HARWIYANTI, S.H., M.KN.', 'SIDOARJO', '499409', '17-01-2022', 'EGA DIVA HARWIYANTI, S.H., M.KN.- Bukti_Pembayaran - WhatsApp Image 2022-01-17 at 15.56.18.jpeg', 'E0409', '1'),
(378, 'FATIMAH, S.H.', 'SIDOARJO', '499406', '17-01-2022', 'FATIMAH, S.H.- Bukti_Pembayaran - InitiateSingleEntryPaymentSummary17-01-2022.pdf', 'F0406', '1'),
(379, 'RATNA INDRASARI,S.H.,M.Kn', 'NGAWI', '499400', '17-01-2022', 'RATNA INDRASARI,S.H.,M.Kn- Bukti_Pembayaran - 16424116005764472615315839854862.jpg', 'R0400', '1'),
(380, 'FITA FITRIYATUL LAILI, SH., M.Kn.', 'PASURUAN', '499363', '17-01-2022', 'FITA FITRIYATUL LAILI, SH., M.Kn.- Bukti_Pembayaran - IMG-20220117-WA0074.jpg', 'F0363', '1'),
(381, 'SRI WAHYU JATMIKOWATI, SH.,MH.', 'SURABAYA', '499410', '17-01-2022', 'SRI WAHYU JATMIKOWATI, SH.,MH.- Bukti_Pembayaran - 20220117_174645.jpg', 'S0410', '1'),
(382, 'EVA PURWANTY, S.E., S.H., M.Kn', 'GRESIK', '499139', '17-01-2022', 'EVA PURWANTY, S.E., S.H., M.Kn- Bukti_Pembayaran - IMG-20220117-WA0031.jpg', 'E0139', '1'),
(383, 'NUZULA HASANAH, SH., M.KN.', 'PASURUAN', '499414', '17-01-2022', 'NUZULA HASANAH, SH., M.KN.- Bukti_Pembayaran - 16424206634885908078294309491273.jpg', 'N0414', '1'),
(384, 'DWI CHANDRA AGUNG KYAI BADERAN, S.H., M.Kn', 'SITUBONDO', '499389', '17-01-2022', 'DWI CHANDRA AGUNG KYAI BADERAN, S.H., M.Kn- Bukti_Pembayaran - 20220117_172508.jpg', 'D0389', '1'),
(385, 'TEDDY ARMANTO, S.H., M.Kn.', 'PASURUAN', '499391', '17-01-2022', 'TEDDY ARMANTO, S.H., M.Kn.- Bukti_Pembayaran - 6C6DCD67-1F75-4CF0-8574-3296379B0355.jpeg', 'T0391', '1'),
(386, 'FERDIANA SEPTRIA RACHMI, SH., M.Kn.', 'PASURUAN', '499380', '17-01-2022', 'FERDIANA SEPTRIA RACHMI, SH., M.Kn.- Bukti_Pembayaran - Screenshot_20220117-200417_BCA mobile.jpg', 'F0380', '1'),
(387, 'SOFA DEWI, SH., M.Kn', 'TUBAN', '499413', '17-01-2022', 'SOFA DEWI, SH., M.Kn- Bukti_Pembayaran - IMG-20220117-WA0034.jpg', 'S0413', '1'),
(388, 'DR. ENDANG SRI KAWURYAN,  S.H., M.HUM', 'KOTA MALANG', '499418', '17-01-2022', 'DR. ENDANG SRI KAWURYAN,  S.H., M.HUM- Bukti_Pembayaran - E0625042-DF1D-4B02-9CB9-A95CAD74B5B5.jpeg', 'D0418', '1'),
(389, 'FRISKA DWIE AUGUSTIA, S.H., M.KN.', 'SIDOARJO', '499420', '17-01-2022', 'FRISKA DWIE AUGUSTIA, S.H., M.KN.- Bukti_Pembayaran - MBRC_1642432160335.png', 'F0420', '1'),
(390, 'VIENA SYAHRANI, S.H., M.Kn.', 'MOJOKERTO', '499412', '17-01-2022', 'VIENA SYAHRANI, S.H., M.Kn.- Bukti_Pembayaran - BUKTI BAYAR KONFERWIL IPPAT 2022.jpg', 'V0412', '1'),
(391, 'TEGUH WICAKSONO, S.H.,M.Kn', 'SITUBONDO', '499415', '17-01-2022', 'TEGUH WICAKSONO, S.H.,M.Kn- Bukti_Pembayaran - MBRC_1642434660073.png', 'T0415', '1'),
(392, 'MOCHAMMAD ALI IMAM, SH., M.Kn.', 'PASURUAN', '499346', '17-01-2022', 'MOCHAMMAD ALI IMAM, SH., M.Kn.- Bukti_Pembayaran - bukti bayar konferwil ippat an. mochammad ali imam sh mkn.jpg', 'M0346', '1'),
(393, 'WITRIE NUR AIDA, S.H., M.KN.', 'KAB KEDIRI', '499423', '18-01-2022', 'WITRIE NUR AIDA, S.H., M.KN.- Bukti_Pembayaran - 42C5F48C-669B-4811-BC07-6CEA3E2737E3.png', 'W0423', '1'),
(394, 'EKO ARI KRISWANTORO, S.H, M.KN.', 'KOTA MOJOKERTO', '499428', '18-01-2022', 'EKO ARI KRISWANTORO, S.H, M.KN.- Bukti_Pembayaran - Screenshot_2022-01-18-07-55-43-175_com.bca.jpg', 'E0428', '1'),
(395, 'BUDI MASRURI, SH., M.Kn', 'LAMONGAN', '499427', '18-01-2022', 'BUDI MASRURI, SH., M.Kn- Bukti_Pembayaran - Budi Masruri, SH., M.Kn. 2022-01-18 at 07.59.34.jpeg', 'B0427', '1'),
(396, 'NURUL LAILI, S.H.', 'MOJOKERTO', '499429', '18-01-2022', 'NURUL LAILI, S.H.- Bukti_Pembayaran - MBRC_1642469058459.png', 'N0429', '1'),
(397, 'YATUN NURYATI, SH., M.Kn.', 'PASURUAN', '499381', '17-01-2022', 'YATUN NURYATI, SH., M.Kn.- Bukti_Pembayaran - BUKTI BYR KONFERWIL.pdf', 'Y0381', '1'),
(398, 'HERI PURWANTO, S.H., M.Kn', 'MAGETAN', '499430', '18-01-2022', 'HERI PURWANTO, S.H., M.Kn- Bukti_Pembayaran - BUKTI BAYAR.jpeg', 'H0430', '1'),
(399, 'IRIEN WIJAYATI HUSEIN, SH', 'BANYUWANGI', '499393', '18-01-2022', 'IRIEN WIJAYATI HUSEIN, SH- Bukti_Pembayaran - WhatsApp Image 2022-01-18 at 08.44.25.jpeg', 'I0393', '1'),
(400, 'YUNUS EFENDI, SH., M.Kn', 'BANGKALAN', '499189', '18-01-2022', 'YUNUS EFENDI, SH., M.Kn- Bukti_Pembayaran - WhatsApp Image 2022-01-18 at 07.43.03.jpeg', 'Y0189', '1'),
(401, 'DJATI PRAMANA, SH, M.KN', 'KABUPATEN MALANG', '499435', '18-01-2022', 'DJATI PRAMANA, SH, M.KN- Bukti_Pembayaran - BB KONFERWIL IPPAT.jpeg', 'D0435', '1'),
(402, 'NUR AINI PUTRI ATMADJA, S.H., M.Kn.', 'MOJOKERTO', '499417', '18-01-2022', 'NUR AINI PUTRI ATMADJA, S.H., M.Kn.- Bukti_Pembayaran - Screenshot_2022-01-18-09-02-48-11_f339d16c976c0b263d991820e972fb72.jpg', 'N0417', '1'),
(403, 'AFDHIKA FAYAKUN ALIF HIDAYAT,SH., M.Kn', 'SUMENEP', '499370', '18-01-2022', 'AFDHIKA FAYAKUN ALIF HIDAYAT,SH., M.Kn- Bukti_Pembayaran - BUKTI BAYAR KONFERWIL IPPAT.jpeg', 'A0370', '1'),
(404, 'WIMPHRY SUWIGNJO, S.H.', 'SURABAYA', '499424', '18-01-2022', 'WIMPHRY SUWIGNJO, S.H.- Bukti_Pembayaran - WhatsApp Image 2022-01-18 at 09.04.42.jpeg', 'W0424', '1'),
(405, 'HAPPY HERAWATI CHANDRA, S.H.', 'SIDOARJO', '499425', '18-01-2022', 'HAPPY HERAWATI CHANDRA, S.H.- Bukti_Pembayaran - WhatsApp Image 2022-01-18 at 09.04.42 (1).jpeg', 'H0425', '1'),
(406, 'LAKSHMI SURYANDARI, S.H.', 'SURABAYA', '499434', '18-01-2022', 'LAKSHMI SURYANDARI, S.H.- Bukti_Pembayaran - IMG_1948.jpg', 'L0434', '1'),
(407, 'HARDI WIGIATONO, SH. M.HUM', 'PASURUAN', '499431', '18-01-2022', 'HARDI WIGIATONO, SH. M.HUM- Bukti_Pembayaran - WhatsApp Image 2022-01-18 at 09.19.26.jpeg', 'H0431', '1'),
(408, 'YUSTINASARI ABIMANYU, S.H.,M.Kn.', 'BANYUWANGI', '499438', '18-01-2022', 'YUSTINASARI ABIMANYU, S.H.,M.Kn.- Bukti_Pembayaran - IMG-20220118-WA0006.jpg', 'Y0438', '1'),
(409, 'ADAM PRAMANA PUTRA, S.H., M.KN.', 'MOJOKERTO', '499440', '18-01-2022', 'ADAM PRAMANA PUTRA, S.H., M.KN.- Bukti_Pembayaran - E654C067-E115-4ABA-80E9-D75D07931D6D.jpeg', 'A0440', '1'),
(410, 'NATALYA YAHYA PUTERI WIJAYA, S.H.', 'SURABAYA', '499392', '17-01-2022', 'NATALYA YAHYA PUTERI WIJAYA, S.H.- Bukti_Pembayaran - BUKTI BAYAR KONFERWIL.jpg', 'N0392', '1'),
(411, 'MUCHTAR, S.H.', 'MOJOKERTO', '499441', '18-01-2022', 'MUCHTAR, S.H.- Bukti_Pembayaran - bukti bayar konferwil.jpg', 'M0441', '1'),
(412, 'EDWIN INDRA NUGRAHA, S.H., M.Kn.', 'MOJOKERTO', '499453', '18-01-2022', 'EDWIN INDRA NUGRAHA, S.H., M.Kn.- Bukti_Pembayaran - Screenshot_2022-01-18-10-08-33-995_com.whatsapp.jpg', 'E0453', '1'),
(413, 'JUSUF PATRIANTO TJAHJONO, S.H.M.H.', 'SURABAYA', '499455', '18-01-2022', 'JUSUF PATRIANTO TJAHJONO, S.H.M.H.- Bukti_Pembayaran - BUKTI BAYAR KONFERWIL2022.jpeg', 'J0455', '1'),
(414, 'INTAN MAHENDRA HANDANI, S. SOS., S. H. M.M., M.KN.', 'KEDIRI', '499457', '18-01-2022', 'INTAN MAHENDRA HANDANI, S. SOS., S. H. M.M., M.KN.- Bukti_Pembayaran - FA736E3A-49CB-4D72-894B-9CB4BBF25020.jpeg', 'I0457', '1'),
(415, 'YOGA MARHAENDRA KUSUMA,S.H.,M.Kn', 'NGAWI', '499456', '18-01-2022', 'YOGA MARHAENDRA KUSUMA,S.H.,M.Kn- Bukti_Pembayaran - MBRC_1642476260722.png', 'Y0456', '1'),
(416, 'ABDUL ROZAK, S.H.', 'MOJOKERTO', '499448', '18-01-2022', 'ABDUL ROZAK, S.H.- Bukti_Pembayaran - bukti bayar konferwil ippat jatim.jpeg', 'A0448', '1'),
(417, 'UMI MAMLU`UL HIKMAH, SH., M.Kn.', 'PASURUAN', '499454', '18-01-2022', 'UMI MAMLU`UL HIKMAH, SH., M.Kn.- Bukti_Pembayaran - WhatsApp Image 2022-01-18 at 10.25.19.jpeg', 'U0454', '1'),
(418, 'RIA DEWANTI, S.H.', 'SIDOARJO', '499460', '18-01-2022', 'RIA DEWANTI, S.H.- Bukti_Pembayaran - DE304426-44A9-450C-A104-45AC0810382F.jpeg', 'R0460', '1'),
(419, 'HELEN SISCERIANY AJINATA, SH.M.Kn', 'GRESIK', '499452', '18-01-2022', 'HELEN SISCERIANY AJINATA, SH.M.Kn- Bukti_Pembayaran - WhatsApp Image 2022-01-18 at 10.31.29.jpeg', 'H0452', '1'),
(420, 'DR. TANDYO HASAN, S.H., M.H., M.Kn.', 'SURABAYA', '499439', '18-01-2022', 'DR. TANDYO HASAN, S.H., M.H., M.Kn.- Bukti_Pembayaran - Hasan Konferwil.pdf', 'D0439', '1'),
(421, 'IMAM ROFIQI, S.H., M.Kn.', 'SUMENEP', '499458', '18-01-2022', 'IMAM ROFIQI, S.H., M.Kn.- Bukti_Pembayaran - WhatsApp Image 2022-01-17 at 19.30.48.jpeg', 'I0458', '1'),
(422, 'DR. INGE SOESANTO, S.H., M.Kn.', 'SURABAYA', '499444', '18-01-2022', 'DR. INGE SOESANTO, S.H., M.Kn.- Bukti_Pembayaran - Inge Konferwil.pdf', 'D0444', '1'),
(423, 'MITCHELL HANS, S.H., M.Kn.', 'SURABAYA', '499445', '18-01-2022', 'MITCHELL HANS, S.H., M.Kn.- Bukti_Pembayaran - Mitchell Konferwil.pdf', 'M0445', '1'),
(424, 'YANA DIAN AHALDIA, SH.,M.Kn', 'KOTA MALANG', '499459', '18-01-2022', 'YANA DIAN AHALDIA, SH.,M.Kn- Bukti_Pembayaran - Screenshot_20220118-104615_Gallery.jpg', 'Y0459', '1'),
(425, 'BAHRUL ULUM, S.H., M.Kn.', 'KABUPATEN MALANG', '499443', '18-01-2022', 'BAHRUL ULUM, S.H., M.Kn.- Bukti_Pembayaran - 16424779022126996523985643957341.jpg', 'B0443', '1'),
(426, 'AGNES LOUISE, S.H., M.Kn', 'GRESIK', '499464', '18-01-2022', 'AGNES LOUISE, S.H., M.Kn- Bukti_Pembayaran - BUKTI BAYAR KONFERWIL 2022.png', 'A0464', '1'),
(427, 'OVI RIO RANDY BASKORO, S.H., M.KN.', 'KAB KEDIRI', '499467', '18-01-2022', 'OVI RIO RANDY BASKORO, S.H., M.KN.- Bukti_Pembayaran - 91247B1A-A720-4666-8799-64825B496258.jpeg', 'O0467', '1'),
(428, 'WAHYUDI SUGIARTO, SH., M.Kn', 'KABUPATEN MALANG', '499411', '18-01-2022', 'WAHYUDI SUGIARTO, SH., M.Kn- Bukti_Pembayaran - BUKTI BAYAR IPPAT 2022.jpg', 'W0411', '1'),
(429, 'ANGGA KUSUMARIADINI NURINDIYANI,S.H., M.Kn.', 'KOTA MALANG', '499403', '18-01-2022', 'ANGGA KUSUMARIADINI NURINDIYANI,S.H., M.Kn.- Bukti_Pembayaran - 1642478174976.png', 'A0403', '1'),
(430, 'MICHAEL WENATA DELAFARE, SH.M.KN.', 'GRESIK', '499469', '18-01-2022', 'MICHAEL WENATA DELAFARE, SH.M.KN.- Bukti_Pembayaran - MBRC_1642478582521.png', 'M0469', '1'),
(431, 'CAROLINE HARYONO, SH. M.Kn.', 'GRESIK', '499463', '18-01-2022', 'CAROLINE HARYONO, SH. M.Kn.- Bukti_Pembayaran - 3BC6044C-7E12-4FBC-8EF9-FCA467B12644.jpeg', 'C0463', '1'),
(432, 'CHIKITA GOENAWAN, SH., M.KN.', 'KOTA MALANG', '499470', '18-01-2022', 'CHIKITA GOENAWAN, SH., M.KN.- Bukti_Pembayaran - Screenshot_20220118-110608_BCA mobile.jpg', 'C0470', '1'),
(433, 'ARIEK WIJAYANTO, S.H.', 'SIDOARJO', '499468', '18-01-2022', 'ARIEK WIJAYANTO, S.H.- Bukti_Pembayaran - WhatsApp Image 2022-01-18 at 11.12.58.jpeg', 'A0468', '1'),
(434, 'VERONIKA DAMAYANTI, S.H., M.Kn.', 'SIDOARJO', '499350', '18-01-2022', 'VERONIKA DAMAYANTI, S.H., M.Kn.- Bukti_Pembayaran - WhatsApp Image 2022-01-18 at 11.20.50 AM.jpeg', 'V0350', '1'),
(435, 'PRALINA RATIH SAVITRI, S.H, M.Kn.', 'KOTA MOJOKERTO', '499472', '18-01-2022', 'PRALINA RATIH SAVITRI, S.H, M.Kn.- Bukti_Pembayaran - KONFERWIL PPAT PRALINA RATIH SAVITRI.jpeg', 'P0472', '1'),
(436, 'MAYA EKASARI BUDININGSIH, S.SOS.,S.H.', 'SURABAYA', '499476', '18-01-2022', 'MAYA EKASARI BUDININGSIH, S.SOS.,S.H.- Bukti_Pembayaran - Bukti bayar Konferwil - Maya Ekasari Budiningsih.png', 'M0476', '1'),
(437, 'RETNO DEWI KARTIKA, S.H., M.Kn.', 'KOTA MOJOKERTO', '499465', '18-01-2022', 'RETNO DEWI KARTIKA, S.H., M.Kn.- Bukti_Pembayaran - IMG-20220118-WA0004.jpg', 'R0465', '1'),
(438, 'FITRI RAHAYU, S.H., M.Kn.', 'SIDOARJO', '499477', '18-01-2022', 'FITRI RAHAYU, S.H., M.Kn.- Bukti_Pembayaran - IMG-20220118-WA0000.jpg', 'F0477', '1'),
(439, 'HJ. FATIMAH ULIFAH, S.H.', 'SURABAYA', '499386', '17-01-2022', 'HJ. FATIMAH ULIFAH, S.H.- Bukti_Pembayaran - Screenshot_20220117-191050.png', 'H0386', '1'),
(440, 'SEKAR ARUM LUPITA SARI, S.H., M.Kn.', 'TRENGGALEK', '499479', '18-01-2022', 'SEKAR ARUM LUPITA SARI, S.H., M.Kn.- Bukti_Pembayaran - 1642481498768.jpg', 'S0479', '1'),
(441, 'NOVITA KUSUMANINGRUM,S.H,M.H', 'NGAWI', '499473', '18-01-2022', 'NOVITA KUSUMANINGRUM,S.H,M.H- Bukti_Pembayaran - 2c6ac745-7fce-44ac-aa74-c8dd94f7eea8.jpg', 'N0473', '1'),
(442, 'DJUNAIDI WIDJOJO, S.H.', 'SURABAYA', '499474', '18-01-2022', 'DJUNAIDI WIDJOJO, S.H.- Bukti_Pembayaran - 20220118_115727.jpg', 'D0474', '1'),
(443, 'DWI RETNOWATI,S.H.,M.Kn', 'NGAWI', '499480', '18-01-2022', 'DWI RETNOWATI,S.H.,M.Kn- Bukti_Pembayaran - BUKTI PEMBAYARAN.jpg', 'D0480', '1'),
(444, 'ASTRID RAHMAJATI, SH.M.Kn.', 'GRESIK', '499482', '18-01-2022', 'ASTRID RAHMAJATI, SH.M.Kn.- Bukti_Pembayaran - IMG-20220118-WA0016.jpg', 'A0482', '1'),
(445, 'TRISNASARI, SH', 'KOTA MALANG', '499437', '18-01-2022', 'TRISNASARI, SH- Bukti_Pembayaran - bukti transfer.jpeg', 'T0437', '1'),
(446, 'LINDA SUKRIS MALINDA SAHONO, SH.', 'GRESIK', '499446', '18-01-2022', 'LINDA SUKRIS MALINDA SAHONO, SH.- Bukti_Pembayaran - Bukti Bayar konferwil jatim .jpeg', 'L0446', '1'),
(447, 'TATANG TARYANA, S.H.', 'SURABAYA', '499483', '18-01-2022', 'TATANG TARYANA, S.H.- Bukti_Pembayaran - konferwil_pembayaran.jpeg', 'T0483', '1'),
(448, 'ANIEK WAHYU INDRIJATI, SH., MH, M.Kn.', 'PASURUAN', '499436', '18-01-2022', 'ANIEK WAHYU INDRIJATI, SH., MH, M.Kn.- Bukti_Pembayaran - 36ADD90C-CF0F-4536-8B49-A78D349ED04D.jpeg', 'A0436', '1'),
(449, 'ANDHIKA BUDIANTO, S.H., M.Kn', 'MAGETAN', '499359', '18-01-2022', 'ANDHIKA BUDIANTO, S.H., M.Kn- Bukti_Pembayaran - WhatsApp Image 2022-01-18 at 12.51.21.jpeg', 'A0359', '1'),
(450, 'FAUZIA MOCHTAR MAPPANGANRO, S.H., M.Kn.', 'MOJOKERTO', '499382', '18-01-2022', 'FAUZIA MOCHTAR MAPPANGANRO, S.H., M.Kn.- Bukti_Pembayaran - WhatsApp Image 2022-01-18 at 12.36.19.jpeg', 'F0382', '1'),
(451, 'CAHYONO, S.H., M.Kn', 'GRESIK', '499421', '17-01-2022', 'CAHYONO, S.H., M.Kn- Bukti_Pembayaran - IMG-20220118-WA0020.jpg', 'C0421', '1'),
(452, 'DEVI KURNIA SARI, SH.,M.Kn', 'KAB. JEMBER & KAB. BONDOWOSO', '499461', '18-01-2022', 'DEVI KURNIA SARI, SH.,M.Kn- Bukti_Pembayaran - WhatsApp Image 2022-01-18 at 15.05.22.jpeg', 'D0461', '1'),
(453, 'ACHMAD REZA PRADANA,S.H.,M.KN', 'NGAWI', '499451', '18-01-2022', 'ACHMAD REZA PRADANA,S.H.,M.KN- Bukti_Pembayaran - bukti bayar konferwil ippat jatim.pdf', 'A0451', '1'),
(454, 'YAHYA JUNAEDI, S.H., M.Kn.', 'SIDOARJO', '499416', '18-01-2022', 'YAHYA JUNAEDI, S.H., M.Kn.- Bukti_Pembayaran - 1642493711319525994551085654335.jpg', 'Y0416', '1'),
(455, 'DANNY RACHMAN HAKIM, S.H., M.Kn.', 'KAB KEDIRI', '499478', '18-01-2022', 'DANNY RACHMAN HAKIM, S.H., M.Kn.- Bukti_Pembayaran - BUKTI BAYAR.jpeg', 'D0478', '1'),
(456, 'DIAN EKO SULISTYO, S.H., M.Kn', 'TULUNGAGUNG', '499433', '18-01-2022', 'DIAN EKO SULISTYO, S.H., M.Kn- Bukti_Pembayaran - MBRC_1642496423866.png', 'D0433', '1'),
(457, 'SETYOYADI, S.H.', 'SURABAYA', '499419', '18-01-2022', 'SETYOYADI, S.H.- Bukti_Pembayaran - Bukti Bayar.jpeg', 'S0419', '1'),
(458, 'NANANG PRASETYO, SH, M.Kn', 'KABUPATEN MALANG', '499466', '18-01-2022', 'NANANG PRASETYO, SH, M.Kn- Bukti_Pembayaran - 0D441973-9226-4253-90E9-8B380873695D.jpeg', 'N0466', '1'),
(459, 'HJ. EVA FITRI SAGITARINA, S.H.', 'SURABAYA', '499422', '18-01-2022', 'HJ. EVA FITRI SAGITARINA, S.H.- Bukti_Pembayaran - 87EA6738-CC6B-4BC7-892A-54568374DB36.jpeg', 'H0422', '1'),
(460, 'WAHYU ARIYAWATI, SH., M.Kn.', 'PASURUAN', '499160', '18-01-2022', 'WAHYU ARIYAWATI, SH., M.Kn.- Bukti_Pembayaran - IMG-20220118-WA0017.jpg', 'W0160', '1'),
(461, 'WIRANINGRUM HAPSARI, S.H, M.KN.', 'SURABAYA', '499487', '18-01-2022', 'WIRANINGRUM HAPSARI, S.H, M.KN.- Bukti_Pembayaran - WhatsApp Image 2022-01-18 at 21.21.16.jpeg', 'W0487', '1'),
(462, 'TINTUS RADITYO KUSUMO', 'TULUNGAGUNG', '499492', '18-01-2022', 'TINTUS RADITYO KUSUMO- Bukti_Pembayaran - 908063BF-DB16-4DDF-BC92-D7F22C2C64B5.png', 'T0492', '1'),
(463, 'AHMAD PROBO SULISTIYO, S.H.,M.Kn.', 'PROBOLINGGO', '499432', '19-01-2022', 'AHMAD PROBO SULISTIYO, S.H.,M.Kn.- Bukti_Pembayaran - Screenshot_20220119-082421_BCA mobile.jpg', 'A0432', '1'),
(464, 'MIEKE RACHMAWATI, SH., M.Kn.', 'PASURUAN', '499447', '19-01-2022', 'MIEKE RACHMAWATI, SH., M.Kn.- Bukti_Pembayaran - Screenshot_20220119-084839_WhatsApp.jpg', 'M0447', '1'),
(465, 'A. NAGHFIR, S.HI.,S.H.,M.Kn', 'SUMENEP', '499449', '19-01-2022', 'A. NAGHFIR, S.HI.,S.H.,M.Kn- Bukti_Pembayaran - WhatsApp Image 2022-01-19 at 09.16.25.jpeg', 'A0449', '1'),
(466, 'M RIZZA GAYUH PRASETYO, S.H., M.Kn.', 'KAB KEDIRI', '499475', '19-01-2022', 'M RIZZA GAYUH PRASETYO, S.H., M.Kn.- Bukti_Pembayaran - Screenshot_2022-01-19-10-29-23-50.png', 'M0475', '1'),
(467, 'AYU MARLIYATY, S.H., M.Kn.', 'SIDOARJO', '499471', '19-01-2022', 'AYU MARLIYATY, S.H., M.Kn.- Bukti_Pembayaran - bukti pembayaran.jpg', 'A0471', '1'),
(468, 'ABDUL KIROM, S.H., M.Kn.', 'SIDOARJO', '499481', '18-01-2022', 'ABDUL KIROM, S.H., M.Kn.- Bukti_Pembayaran - abdul kirom.jpeg', 'A0481', '1'),
(469, 'INDAH WATI, SH., M.Kn.', 'PASURUAN', '499408', '19-01-2022', 'INDAH WATI, SH., M.Kn.- Bukti_Pembayaran - indahwati.jpeg', 'I0408', '1'),
(470, 'YANUAR ISKANDAR, S.H., M.Kn.', 'SIDOARJO', '499484', '19-01-2022', 'YANUAR ISKANDAR, S.H., M.Kn.- Bukti_Pembayaran - yanaur.jpeg', 'Y0484', '1'),
(471, 'AUDRI YOLANDO WIBOWO, S.H, M.KN.', 'KOTA MOJOKERTO', '499493', '19-01-2022', 'AUDRI YOLANDO WIBOWO, S.H, M.KN.- Bukti_Pembayaran - audri.jpeg', 'A0493', '1'),
(472, 'MIRZA PRIMA KUSUMANINGAYU, S.H, M.Kn.', 'KOTA MOJOKERTO', '499489', '19-01-2022', 'MIRZA PRIMA KUSUMANINGAYU, S.H, M.Kn.- Bukti_Pembayaran - FB21D032-71D1-46A7-A390-809C9691EF5C.png', 'M0489', '1'),
(473, 'ANANG EFENDI, S.H., M.Kn', 'PROBOLINGGO', '499486', '19-01-2022', 'ANANG EFENDI, S.H., M.Kn- Bukti_Pembayaran - anang.jpeg', 'A0486', '1'),
(474, 'DYTA RAGELLYA ANGGRAINI, SH., M.Kn.', 'PASURUAN', '499388', '19-01-2022', 'DYTA RAGELLYA ANGGRAINI, SH., M.Kn.- Bukti_Pembayaran - dyta pasuruan.jpeg', 'D0388', '1'),
(475, 'RR. SRI UTARI, S.H.', 'SIDOARJO', '499485', '19-01-2022', 'RR. SRI UTARI, S.H.- Bukti_Pembayaran - BUKTI BAYAR.jpg', 'R0485', '1'),
(476, 'DEWI RAHAYU, S.H., M.Kn.', 'MOJOKERTO', '499450', '19-01-2022', 'DEWI RAHAYU, S.H., M.Kn.- Bukti_Pembayaran - dewi rahayu.jpeg', 'D0450', '1'),
(477, 'CATHARINA HARTINI SOENGKONO, S.H., M.Kn.', 'SURABAYA', '499490', '19-01-2022', 'CATHARINA HARTINI SOENGKONO, S.H., M.Kn.- Bukti_Pembayaran - catharina.jpeg', 'C0490', '1'),
(478, 'INEU MAULENI, SH', 'SURABAYA', '499491', '19-01-2022', 'INEU MAULENI, SH- Bukti_Pembayaran - WhatsApp Image 2022-01-19 at 15.24.37.jpeg', 'I0491', '1'),
(479, 'PENI NUSWANTARI, S.H, M.Kn.', 'KOTA MOJOKERTO', '499462', '19-01-2022', 'PENI NUSWANTARI, S.H, M.Kn.- Bukti_Pembayaran - WhatsApp Image 2022-01-19 at 15.03.39.jpeg', 'P0462', '1'),
(480, 'ANDRIAS SETYADI,S.H.,M.Kn', 'NGANJUK', '499324', '19-01-2022', 'ANDRIAS SETYADI,S.H.,M.Kn- Bukti_Pembayaran - WhatsApp Image 2022-01-19 at 14.59.23.jpeg', 'A0324', '1'),
(481, 'NUR AMALIAH RANIE, S.H., M.Kn.', 'SITUBONDO', '499496', '24-12-2021', 'NUR AMALIAH RANIE, S.H., M.Kn.- Bukti_Pembayaran - B2BFC5E0-EC03-4C02-97E3-8AAA673D743B.jpeg', 'N0496', '1'),
(482, 'MUHAMMAD YUSUF ACHMAD, SE., S.H., M.Kn', 'LAMONGAN', '499426', '18-01-2022', 'MUHAMMAD YUSUF ACHMAD, SE., S.H., M.Kn- Bukti_Pembayaran - WhatsApp Image 2022-01-18 at 12.45.48.jpeg', 'M0426', '1'),
(483, 'GEMA BISMANTAKA, S.H., M.Kn.', 'MOJOKERTO', '499497', '20-01-2022', 'GEMA BISMANTAKA, S.H., M.Kn.- Bukti_Pembayaran - mirza.jpeg', 'G0497', '1'),
(484, 'WINARNI, SH', 'BOJONEGORO', '499494', '20-01-2022', 'WINARNI, SH- Bukti_Pembayaran - WhatsApp Image 2022-01-19 at 12.14.57.jpeg', 'W0494', '1'),
(485, 'ELLY WAHYUNINGSIH, SH, M.Kn', 'KABUPATEN MALANG', '499498', '21-01-2022', 'ELLY WAHYUNINGSIH, SH, M.Kn- Bukti_Pembayaran - WhatsApp Image 2022-01-21 at 08.45.48.jpeg', 'E0498', '1'),
(486, 'WINARIYATI, S.H., M.Kn', 'GRESIK', '499499', '21-01-2022', 'WINARIYATI, S.H., M.Kn- Bukti_Pembayaran - WhatsApp Image 2022-01-21 at 09.42.25.jpeg', 'W0499', '1'),
(487, 'NAFILAH, SH, M.KN', 'KABUPATEN MALANG', '499500', '21-01-2022', 'NAFILAH, SH, M.KN- Bukti_Pembayaran - WhatsApp Image 2022-01-21 at 09.46.29 (1).jpeg', 'N0500', '1');

-- --------------------------------------------------------

--
-- Table structure for table `loginabsensi`
--

CREATE TABLE `loginabsensi` (
  `id` int(11) NOT NULL,
  `username` varchar(50) DEFAULT NULL,
  `pass` varchar(50) DEFAULT NULL,
  `pengda1` varchar(255) DEFAULT NULL,
  `pengda2` varchar(255) DEFAULT NULL,
  `pengda3` varchar(255) DEFAULT NULL,
  `sesi` varchar(50) DEFAULT NULL
) ENGINE=InnoDB DEFAULT CHARSET=latin1;

--
-- Dumping data for table `loginabsensi`
--

INSERT INTO `loginabsensi` (`id`, `username`, `pass`, `pengda1`, `pengda2`, `pengda3`, `sesi`) VALUES
(10, 'presidium', '123456', NULL, NULL, NULL, '2'),
(11, 'gresik', '12345', 'GRESIK', NULL, NULL, '2'),
(12, 'sidoarjo', '12345', 'SIDOARJO', NULL, NULL, '2'),
(13, 'surabaya', '12345', 'SURABAYA', NULL, NULL, '2'),
(14, 'lamongan', '12345', 'LAMONGAN', NULL, NULL, '2'),
(15, 'tuban', '12345', 'TUBAN', NULL, NULL, '2'),
(16, 'mojokerto', '12345', 'MOJOKERTO', NULL, NULL, '2'),
(17, 'jombang', '12345', 'JOMBANG', NULL, NULL, '2'),
(18, 'pasuruan', '12345', 'PASURUAN', NULL, NULL, '2'),
(19, 'malang', '12345', 'MALANG', NULL, NULL, '2'),
(20, 'bojonegoro', '12345', 'BOJONEGORO', NULL, NULL, '2'),
(21, 'madura', '12345', 'MADURA', NULL, NULL, '2'),
(22, 'situbondo', '12345', 'SITUBONDO', NULL, NULL, '2'),
(23, 'lumajang', '12345', 'LUMAJANG', NULL, NULL, '2'),
(24, 'kediri', '12345', 'KEDIRI', NULL, NULL, '2'),
(25, 'banyuwangi', '12345', 'BANYUWANGI', NULL, NULL, '2'),
(26, 'jember', '12345', 'JEMBER', NULL, NULL, '2'),
(27, 'probolinggo', '12345', 'PROBOLINGGO', NULL, NULL, '2'),
(28, 'madiun', '12345', 'MADIUN', NULL, NULL, '2');

-- --------------------------------------------------------

--
-- Table structure for table `pendaftaran`
--

CREATE TABLE `pendaftaran` (
  `id` int(11) NOT NULL,
  `nama` varchar(255) DEFAULT NULL,
  `pengda` varchar(250) DEFAULT NULL
) ENGINE=InnoDB DEFAULT CHARSET=latin1;

--
-- Dumping data for table `pendaftaran`
--

INSERT INTO `pendaftaran` (`id`, `nama`, `pengda`) VALUES
(1, 'ADITYA SETYA WICAKSANA, S.H., M.Kn', 'PAMEKASAN'),
(2, 'ADRINA DEVANI SUGIRI, S.H., M.Kn', 'PAMEKASAN'),
(3, 'ANDRI ISKANDAR, S.H., M.Kn', 'PAMEKASAN'),
(4, 'ANISA EVI SULIYANTI, S.H., M.Kn', 'PAMEKASAN'),
(5, 'CHRISTYANI KUSUMANINGTYAS, S.H., M.Kn', 'PAMEKASAN'),
(6, 'CHURIAH LAYLIA, S.H., M.Kn', 'PAMEKASAN'),
(7, 'CYNTHIA NITI SANTOSO, S.H., M.Kn', 'PAMEKASAN'),
(8, 'DR. ABDUR RAHMAN, S.H., M.Kn', 'PAMEKASAN'),
(9, 'DR. FIRMANSJAH, S.H., M.Hum', 'PAMEKASAN'),
(10, 'HAULAH HARITS WAHDIN, S.H., M.Kn', 'PAMEKASAN'),
(11, 'HERY PRASETIO, S.H., M.Kn', 'PAMEKASAN'),
(12, 'HJ AISY LADZIDZA, S.H., M.Kn', 'PAMEKASAN'),
(13, 'KHOIRUN NISA, S.H', 'PAMEKASAN'),
(14, 'KUSMANTO, S.H., M.Kn', 'PAMEKASAN'),
(15, 'LUKMANUL HAKIM, S.H., M.Kn', 'PAMEKASAN'),
(16, 'MOH BAFARIRAHMAN PRATAMA, S.H., M.Kn', 'PAMEKASAN'),
(17, 'M SYAIFUL ANSHARI, S.H., M.Kn', 'PAMEKASAN'),
(18, 'NAJIB ZAKIN, S.H., M.Kn', 'PAMEKASAN'),
(19, 'NANIK KUSUMIATI HUDAYA, S.H., M.Kn', 'PAMEKASAN'),
(20, 'NOVIETA FENNY INDARWATI, S.H., M.Kn', 'PAMEKASAN'),
(21, 'RETNO YUNIAR ISKANDAR, S.H., M.Kn', 'PAMEKASAN'),
(22, 'ROSITA ANGGRAINI, S.H., M.Kn', 'PAMEKASAN'),
(23, 'SALMA SAFITRI, S.H., M.Kn', 'PAMEKASAN'),
(24, 'SRI UTAMI, S.H', 'PAMEKASAN'),
(25, 'SRI WULANDARI, S.H., M.Kn', 'PAMEKASAN'),
(26, 'SULISTIAWATI, S.H., M.Kn', 'PAMEKASAN'),
(27, 'SURYO HADI UTOMO, S.H., M.Kn', 'PAMEKASAN'),
(28, 'TINUK SETIYAWATI, S.H', 'PAMEKASAN'),
(29, 'WAHYUNI ANDARUKMI, SH., M.Kn', 'PACITAN'),
(30, 'YANTI KOMALAWATI, SH', 'PACITAN'),
(31, 'RR. CHRYS WAHYU INDRAWATI, SH., M.Kn', 'PACITAN'),
(32, 'SAADIAH SURYANDARI, SH., M.Kn', 'PACITAN'),
(33, 'FERRY FERDIANSYAH, SH., M.Kn', 'PACITAN'),
(34, 'DERI ANDRIAS SUBIYANTO, S.H., M.H.', 'PACITAN'),
(35, 'IKHWAN SAPTA NUGRAHA, SH., M.Kn.', 'PACITAN'),
(36, 'SURANINGSIH,S.SOS.,S.H.,M.Kn.', 'PACITAN'),
(37, 'IRWAN ISMURATNO, SE., SH,. M.Kn', 'PACITAN'),
(38, 'WAHYU ADI MUDIPARWANTO, S.H.,M.Kn', 'PACITAN'),
(39, 'RINI PUJI ASTUTI, S.H., M.Kn', 'PACITAN'),
(40, 'ACHMAD SHALEH, SH.', 'KAB. JEMBER & KAB. BONDOWOSO'),
(41, 'ABBAS SAID BAUZIR, SH.', 'KAB. JEMBER & KAB. BONDOWOSO'),
(42, 'ACHMAD MUTHAR, SH.', 'KAB. JEMBER & KAB. BONDOWOSO'),
(43, 'BADI\'AH, SH.', 'KAB. JEMBER & KAB. BONDOWOSO'),
(44, 'BAMBANG HERMANTO, SH.', 'KAB. JEMBER & KAB. BONDOWOSO'),
(45, 'BUDI KARTIKA NINGSIH, SH.', 'KAB. JEMBER & KAB. BONDOWOSO'),
(46, 'DIYAH ARIYANI P, SH.', 'KAB. JEMBER & KAB. BONDOWOSO'),
(47, 'DWI MANGESTU NINGTYAS, SH.M.Kn.', 'KAB. JEMBER & KAB. BONDOWOSO'),
(48, 'ELLY HERAWATI SUTEDJO, SH.', 'KAB. JEMBER & KAB. BONDOWOSO'),
(49, 'ENDAH DIANTI WULANDARI, SH.', 'KAB. JEMBER & KAB. BONDOWOSO'),
(50, 'ELOK SUNARINGTYAS MAHANANI, SH.', 'KAB. JEMBER & KAB. BONDOWOSO'),
(51, 'ETTY SOENTARI, SH.', 'KAB. JEMBER & KAB. BONDOWOSO'),
(52, 'FATHUR RAHMAN, SH.', 'KAB. JEMBER & KAB. BONDOWOSO'),
(53, 'IRWAN ROSMAN, SH.,M.Kn.', 'KAB. JEMBER & KAB. BONDOWOSO'),
(54, 'ISRO VITA NUGRAHANI, SH.', 'KAB. JEMBER & KAB. BONDOWOSO'),
(55, 'IS HARIYANTO I.S, SH.', 'KAB. JEMBER & KAB. BONDOWOSO'),
(56, 'MUTI`ATUL KHASANAH, SH.', 'KAB. JEMBER & KAB. BONDOWOSO'),
(57, 'RUWI JULSI, SH.', 'KAB. JEMBER & KAB. BONDOWOSO'),
(58, 'SITI LESTARI N, SH.', 'KAB. JEMBER & KAB. BONDOWOSO'),
(59, 'DEVI KURNIA SARI, SH.,M.Kn', 'KAB. JEMBER & KAB. BONDOWOSO'),
(60, 'NURUL NADIRA, SH,. M.Kn', 'KAB. JEMBER & KAB. BONDOWOSO'),
(61, 'SITI NURFARIDA, SE, SH.', 'KAB. JEMBER & KAB. BONDOWOSO'),
(62, 'ANUGRAHANI. D. A. SH.', 'KAB. JEMBER & KAB. BONDOWOSO'),
(63, 'ERMI SUNARSIH, SH.', 'KAB. JEMBER & KAB. BONDOWOSO'),
(64, 'YUDANTI N, SH.', 'KAB. JEMBER & KAB. BONDOWOSO'),
(65, 'DWI NORMA SARI, SH. M.Kn', 'KAB. JEMBER & KAB. BONDOWOSO'),
(66, 'AIMAN W, SH., M.Kn.', 'KAB. JEMBER & KAB. BONDOWOSO'),
(67, 'SINTA ROEMONDANG R, SH., M.Kn', 'KAB. JEMBER & KAB. BONDOWOSO'),
(68, 'EKO P.LAMAK, SH., M.Kn', 'KAB. JEMBER & KAB. BONDOWOSO'),
(69, 'HANDOYO, SH., M.Kn', 'KAB. JEMBER & KAB. BONDOWOSO'),
(70, 'NURUL KUSUMA WARDANI, SH., M.Kn', 'KAB. JEMBER & KAB. BONDOWOSO'),
(71, 'RATNA DJUWITA, SH., M.Kn', 'KAB. JEMBER & KAB. BONDOWOSO'),
(72, 'UKE KARTIKA.T. R, SH., M.Kn', 'KAB. JEMBER & KAB. BONDOWOSO'),
(73, 'SAPTA RAHAYU, SH., M.Kn', 'KAB. JEMBER & KAB. BONDOWOSO'),
(74, 'SATRIA PANDUTAMA, SH., M.Kn', 'KAB. JEMBER & KAB. BONDOWOSO'),
(75, 'YONAS D. WATTIE, SH., M.Kn', 'KAB. JEMBER & KAB. BONDOWOSO'),
(76, 'MOHAMMAD ALI HIDAYAT, SH., M.Kn', 'KAB. JEMBER & KAB. BONDOWOSO'),
(77, 'EVA KUMALA SARI, SH., M.Kn', 'KAB. JEMBER & KAB. BONDOWOSO'),
(78, 'M. ROCKY DIAN, SH., M.Kn', 'KAB. JEMBER & KAB. BONDOWOSO'),
(79, 'DEWI ANGGRAINI, SH., M.Kn', 'KAB. JEMBER & KAB. BONDOWOSO'),
(80, 'RIZA NURWULANDARI, SH., M.Kn', 'KAB. JEMBER & KAB. BONDOWOSO'),
(81, 'NOPIWARTI HANDAYANI, SH., M.Kn', 'KAB. JEMBER & KAB. BONDOWOSO'),
(82, 'ERNA MUJIARTI, SH., M.Kn', 'KAB. JEMBER & KAB. BONDOWOSO'),
(83, 'AMALIYAH CHOLILY, SH., M.Kn', 'KAB. JEMBER & KAB. BONDOWOSO'),
(84, 'NOVIAN R R, SH., M.Kn', 'KAB. JEMBER & KAB. BONDOWOSO'),
(85, 'WIDHA S. W, SH., M.Kn', 'KAB. JEMBER & KAB. BONDOWOSO'),
(86, 'DENNY MAY TIMOR, SH. M.Kn.', 'KAB. JEMBER & KAB. BONDOWOSO'),
(87, 'HAPSARI, SH., M.Kn.', 'KAB. JEMBER & KAB. BONDOWOSO'),
(88, 'ESTI SETYOWATI, SH, M.Kn.', 'KAB. JEMBER & KAB. BONDOWOSO'),
(89, 'FIRMAN TEGUH PRAYOGO. SH., M.Kn', 'KAB. JEMBER & KAB. BONDOWOSO'),
(90, 'IBNU TAUFIK ANDALUSY. SH., M.Kn', 'KAB. JEMBER & KAB. BONDOWOSO'),
(91, 'SHERLI HARDHYARTI PURWANINGHAPSARI, SH., M.Kn', 'KAB. JEMBER & KAB. BONDOWOSO'),
(92, 'MUHANDAS AGIT PRASETYA, S.H., M.Kn', 'KAB. JEMBER & KAB. BONDOWOSO'),
(93, 'RAHMANIA MADYA PUTRI HARDIANI, S.H., M.Kn', 'KAB. JEMBER & KAB. BONDOWOSO'),
(94, 'DEWI MARDANI, SH., M.Kn', 'KAB. JEMBER & KAB. BONDOWOSO'),
(95, 'PRATIWI HIDAYANI SH.,M.Kn', 'KAB. JEMBER & KAB. BONDOWOSO'),
(96, 'SHELLA NORMA YUNITA SH.,M.Kn', 'KAB. JEMBER & KAB. BONDOWOSO'),
(97, 'ONNY BUNGA NOVASARI SH.,M.Kn', 'KAB. JEMBER & KAB. BONDOWOSO'),
(98, 'HANIF NUR SUSETYO SH.,M.Kn', 'KAB. JEMBER & KAB. BONDOWOSO'),
(99, 'FELICIA MELISSA YUANITA , SH., M.Kn', 'KAB. JEMBER & KAB. BONDOWOSO'),
(100, 'DHENANDRA MAHARDIKA SUKMANA, SH., M.Kn', 'KAB. JEMBER & KAB. BONDOWOSO'),
(101, 'NOVADASA ANGGRAINI, SH., M.Kn', 'KAB. JEMBER & KAB. BONDOWOSO'),
(102, 'KARLOS FEBRIANTO SOBUEA SH., M.Kn', 'KAB. JEMBER & KAB. BONDOWOSO'),
(103, 'WAHYU ELMA NAF`AN, SH., M.Kn', 'KAB. JEMBER & KAB. BONDOWOSO'),
(104, 'MAYRITHA SH.M.Kn', 'KAB. JEMBER & KAB. BONDOWOSO'),
(105, 'ATOK NAIMULLOH, SH., M.Kn', 'KAB. JEMBER & KAB. BONDOWOSO'),
(106, 'MIKE RIZKI AMALIA SH.,M.Kn', 'KAB. JEMBER & KAB. BONDOWOSO'),
(107, 'DYAH AYU PRATIWI SH.,M.Kn', 'KAB. JEMBER & KAB. BONDOWOSO'),
(108, 'ACHMAD BASITH BRAVIANTO SH., M.Kn', 'KAB. JEMBER & KAB. BONDOWOSO'),
(109, 'MOCH. FARID HUSNI ., SH., M.Kn', 'KAB. JEMBER & KAB. BONDOWOSO'),
(110, 'LIA WAHYU LESTARI, SH.M.Kn', 'KAB. JEMBER & KAB. BONDOWOSO'),
(111, 'ERNA TRI MOERHADIATI, SH.,M.Kn', 'KAB. JEMBER & KAB. BONDOWOSO'),
(112, 'ALFIANSYAH, SH.,.M. KN', 'KAB. JEMBER & KAB. BONDOWOSO'),
(113, 'MELISSA PRATIWI SILIANTO, SH.,M.Kn', 'KAB. JEMBER & KAB. BONDOWOSO'),
(114, 'YUDISHTIRA ADI NUGROHO, SH.,M.Kn', 'KAB. JEMBER & KAB. BONDOWOSO'),
(115, 'ANDHITA SELLASARI SH., M.Kn', 'KAB. JEMBER & KAB. BONDOWOSO'),
(116, 'NONIS AGENG MAHARANI, SH.,M.Kn', 'KAB. JEMBER & KAB. BONDOWOSO'),
(117, 'ANDIKA PUTRA ESKA NUGRAHA, SH., M.Kn.', 'KAB. JEMBER & KAB. BONDOWOSO'),
(118, 'IVO D KUMALA SH.,M.Kn', 'KAB. JEMBER & KAB. BONDOWOSO'),
(119, 'ANDY MARTINO, SH.,M.Kn', 'KAB. JEMBER & KAB. BONDOWOSO'),
(120, 'AMELIA ANGGI PRADIPTA SH.,M.Kn', 'KAB. JEMBER & KAB. BONDOWOSO'),
(121, 'ARYA MANGGALA YUDHA SH.,M.Kn', 'KAB. JEMBER & KAB. BONDOWOSO'),
(122, 'MELYANA TRISNAWATI, SH.,.M.Kn', 'KAB. JEMBER & KAB. BONDOWOSO'),
(123, 'AJENG FITRAH RAMADHANI., S.H., M.Kn', 'KAB. JEMBER & KAB. BONDOWOSO'),
(124, 'ZIMRI BOY YOYADA SINUHAJI SH.,M.Kn', 'KAB. JEMBER & KAB. BONDOWOSO'),
(125, 'AHMAD BADAWI, S.H., M.Kn.', 'KAB. JEMBER & KAB. BONDOWOSO'),
(126, 'FERDY SALIM SH., M.Kn', 'KAB. JEMBER & KAB. BONDOWOSO'),
(127, 'PALUPI TITISARI., S.H., M.Kn', 'KAB. JEMBER & KAB. BONDOWOSO'),
(128, 'IRMADELA VERDIANA, SH., M.Kn', 'KAB. JEMBER & KAB. BONDOWOSO'),
(129, 'SUTOMO, SH', 'PONOROGO'),
(130, 'HARTATI HADIWIJAYA, S.H', 'PONOROGO'),
(131, 'YUNIANTORO, S.H', 'PONOROGO'),
(132, 'MARDIANA MARUWI, S.H', 'PONOROGO'),
(133, 'SETYA BUDHI, S.H', 'PONOROGO'),
(134, 'DYAH ANTARUKMI PURWANINGRUM, S.H.,M.Hum.,M.Kn', 'PONOROGO'),
(135, 'DEVI SOVIAN, S.H.,M.Kn', 'PONOROGO'),
(136, 'UTAND MAHARDOYO, S.H.,M.Kn', 'PONOROGO'),
(137, 'UNGGUL SULISTIAWAN, S.H.,M.Kn', 'PONOROGO'),
(138, 'AGUS TRI SUTANTO, S.H.,M.Kn', 'PONOROGO'),
(139, 'DEMA NURHAYATI, S.H., M.Kn', 'PONOROGO'),
(140, 'ERLINA KUSUMANINGDIAH, S.H., M.Kn.', 'PONOROGO'),
(141, 'KRISNA ADI WIJAYA, S.H., M.Kn.', 'PONOROGO'),
(142, 'SONY BELLA PRAKAWAN, S.H., M.Kn.', 'PONOROGO'),
(143, 'AYU BIMO SETYO PUTRI, S.H., M.Kn.', 'PONOROGO'),
(144, 'RATNA TUNJUNG WARIH, S.H., M.Kn.', 'PONOROGO'),
(145, 'SUTONO,S.H.,M.Kn', 'PONOROGO'),
(146, 'EKA APRIYUDI,S.H.,M.Kn', 'PONOROGO'),
(147, 'BAYU JAYA PRADANA,S.H.,M.Kn', 'PONOROGO'),
(148, 'WINNA SAMPAGUITA,S.H.,M.Kn', 'PONOROGO'),
(149, 'FRANSISKA AVELINA SITANGGANG,S.H.,M.Kn', 'PONOROGO'),
(150, 'ERNI FITRIA RAHAYU,S.H.,M.Kn', 'PONOROGO'),
(151, 'YELINA RACHMA PRANAMAWATI,S.H.,M.H', 'PONOROGO'),
(152, 'MUHAIMIN,S.H.,M.Kn', 'PONOROGO'),
(153, 'INTAN MERDEKASARI.,SH.,MH', 'PONOROGO'),
(154, 'DAMAR ARIADI ,S.H.,M.Kn', 'PONOROGO'),
(155, 'CHUSNUL ALIFAH,S.H.,M.Kn', 'PONOROGO'),
(156, 'HASIM ASHARI,SH.,M.Kn', 'PONOROGO'),
(157, 'MIA PERMATA SARI, SH.,M.Kn', 'PONOROGO'),
(158, 'BAYU NUR ROCHIM,SH.,M.Kn', 'PONOROGO'),
(159, 'ARY RAY SANG RIZALDI,SH.,M.Kn', 'PONOROGO'),
(160, 'RIAD LADIKA GUTAN, SH.,M.Kn', 'PONOROGO'),
(161, 'A. JUNAIDI, SH. MH. LL.M. M.Kn.', 'GRESIK'),
(162, 'ACHMAD MUIN, S.H., S.E., M.Kn', 'GRESIK'),
(163, 'ACHMAD NUESKI MEIRINGGA, S.H., M.Kn', 'GRESIK'),
(164, 'ADHITYA HANDIE SAPUTRA, S.H., M.Kn', 'GRESIK'),
(165, 'ADIARTI PURNALITA, S.H., M.Kn', 'GRESIK'),
(166, 'ADIL SURYA DHARMA, SH.M.Kn.', 'GRESIK'),
(167, 'AFIFAH, SH., M.Kn', 'GRESIK'),
(168, 'AGIL SUWARTO, SH.M.Kn.', 'GRESIK'),
(169, 'AGNES LOUISE, S.H., M.Kn', 'GRESIK'),
(170, 'AGUS PRAYITNO, S.H., M.Kn', 'GRESIK'),
(171, 'AGUS RUSMANHADI S., SH.M.Kn.', 'GRESIK'),
(172, 'ALDILA WAHYU KARTIKA, S.H., M.Kn', 'GRESIK'),
(173, 'ALICCE HAVANA MARLIS, S.H., M.Kn', 'GRESIK'),
(174, 'AMANDA MIRZA ERVARIANA, S.H., M.Kn', 'GRESIK'),
(175, 'AMANDA PUSPITA, SH. M.Kn.', 'GRESIK'),
(176, 'AMI RADITYA, S.H., M.Kn', 'GRESIK'),
(177, 'AMRIDA THALIB, SH.M.Kn.', 'GRESIK'),
(178, 'ANDAYANI RISILAWATI, SH. M.Kn.', 'GRESIK'),
(179, 'ANDHINI FAJAR PRISTANTI S.H, M.Kn', 'GRESIK'),
(180, 'ANNIS SETIAWAN, SH.M.Kn.', 'GRESIK'),
(181, 'ANWAR, S.H., M.Kn', 'GRESIK'),
(182, 'ARDIYANTO SUNARKO, S.H., M.Kn', 'GRESIK'),
(183, 'ARIFIN HARTANTO, SH.M.Kn.', 'GRESIK'),
(184, 'ARISTA NURUL SHOFANISA, S.H., M.Kn', 'GRESIK'),
(185, 'ARRUM ARIFANI, S.H., M.Kn', 'GRESIK'),
